,Artist,Title,Album,Year,Date,Lyric
70,Beyoncé,I’d Rather Go Blind,Cadillac Records: Music From the Motion Picture,2008,2008-12-02,something told me it was over yeah when i saw you and her talking deep something deep down in my soul said cry girl cry cry when i saw you and that girl walking around whoo ooh   i would rather i would rather go blind boy then to see you walk away from me child naw naw whoo ooh   so you see i love you so much that i don't wanna watch you leave me baby most of all i just don't i just don't wanna be free now whoo ooh woo oh i was just i was just i was just sitting here thinking of your kiss and your warm embrace yeah when a reflection in a glass that i held to my lips now baby revealed these tears that are on my face whoo ooh   and baby and baby baby i'd rather be blind boy then to see you walk away walk away from me yeah and baby baby baby i'd rather be blind boy then to see you walk away walk away from me
71,Beyoncé,Denial (Poem),,nan,nan,i tried to change closed my mouth more tried to be soft prettier less awake fasted for 60 days wore white abstained from mirrors abstained from sex slowly did not speak another word and that time my hair i grew past my ankles i slept on a mat on the floor i swallowed a sword i levitated into the basement confessed my sins and was baptized in a river got on my knees and said amen and said i mean i whipped my own back and asked for dominion at your feet i threw myself into a volcano i drank the blood and drank the wine i sat alone in begged and bent at the waist for god i crossed myself in thought i saw the devil i grew thickened skin on my feet i bathed in bleach and plugged my menses with the pages from the holy book but still inside me coiled deep was the need to know are you cheating are you cheating on me
72,Beyoncé,Kitty Kat,B’Day,2006,2006-09-04,you know i hate sleeping alone but you said that you would soon be home but baby that was a long time ago i'm not feelin' it i'm not feelin' it on top of you not callin' me back you see i bet you think it's all on track and you actin' like it's all o' that i'm not feelin' it i'm not feelin' it let's go let's go little kitty cat i think it's time to go let's go little kitty cat he don't want no mo' let's go little kitty cat quite frankly no more givin' it i'm not feelin' it   it's like we at two places but different paces we in trouble but you won't meet me at the  it hurts it feels deserted did you forget where your heart lives  pre what about my body body you don't want my body body acting like i'm not nobody you gon' make me call somebody what about my body body what about my body body you would rather go and party somehow somewhere i'll be naughty   you know i hate sleeping alone but you said that you would soon be home but baby that was a long time ago i'm not feelin' it i'm not feelin' it on top of you not callin' me back you see i bet you think it's all on track and you actin' like it's all o' that i'm not feelin' it i'm not feelin' it let's go let's go little kitty cat i think it's time to go let's go little kitty cat he don't want no mo' let's go little kitty cat quite frankly no more givin' it i'm not feelin' it   let me show you how to get there take a left to compassion lights will be flashin' keep straight and you'll see the sun right there affection you're in the wrong direction if i get caught see it just seems that you don't care  pre what about my body body you don't want my body body acting like i'm not nobody you gon' make me call somebody what about my body body what about my body body you would rather go and party somehow somewhere i'll be naughty   you know i hate sleeping alone but you said that you would soon be home said that you would soon be home but baby that was a long time ago i'm not feelin' it i'm not feelin' it on top of you not calling me back you see i bet you think it's all on track and you actin' like it's all o' that i'm not feeling it i'm not feeling it let's go let's go little kitty cat i think it's time to go he don't want no mo' let's go little kitty cat quite frankly no more givin' it i'm not feelin' it   i'm taking back the things i got from you you and that includes my sweet little nookie too too let's go let's go let's go little kitty cat kitty cat he don't want you anymore no uh uh uh let's go let's go let's go little kitty cat kitty cat he don't want you anymore no ooh ooh   got diamonds on my neck got diamonds on my records since 6 i was coming down reppin' texas how you gon' neglect this you is just a hot mess you can call tyrone you ain't gots to lie craig  pre variation what about my body body what about by my body body i'm in the house all alone you rather go and party what about my body body you don't want my body body acting like i'm nobody you gon' make me call somebody   let's go let's go little kitty cat i think it's time to go let's go little kitty cat he ain't want no mo' let's go little kitty cat no mo' getting' it i'm not feelin' it
73,Beyoncé,OTHERSIDE,The Lion King: The Gift,2019,2019-07-19,beyoncé if the storm comes if we burn up if the wells run dry you're my reason to believe in another life   beyoncé if it all ends and it's over if the sky falls fire best believe me you will see me on the other side   beyoncé if we wake up lose our patience or even lose our lives oh i'll feel lucky to say that you've been a friend of mine   beyoncé best believe me you will see me on the other side   bankulli  beyoncé sọ kalẹ sọ kalẹ sọ kalẹ wá wá o wá o wá wọnú ọkàn mi lọ olúwa mababu katika mawingu sọ kalẹ mababu katika mawingu olúwa mababu katika mawingu sọ kalẹ mababu katika mawingu olúwa mababu katika mawingu sọ kalẹ mababu katika mawingu olúwa mababu katika mawingu sọ kalẹ mababu katika mawingu oluwa mababu katika mawingu sọ kalẹ mababu katika mawingu
74,Beyoncé,I Care,4,2012,2012-03-23,i told you how you hurt me baby but you don't care now i'm crying and deserted baby but you don't care ain't nobody tell me this is love when you're immune to all my pain i need you to tell me this is love you don't care well that's okay   well i care i know you don't care too much but i still care baby oh i care i know you don't care too much but i still care baby   ever since you knew your power you made me cry and now everytime our love goes sour you won't sympathize you see these tears falling down to my ears i swear you like when i'm in pain yeah i try to tell you all my fears you still don't care that's okay   well i care i know you don't care too much but i still care baby oh i care i know you don't care too much but i still care baby   boy maybe if you cared enough i wouldn't have to care so much what happened to our trust now you're just given up you used to be so in love now you don't care no more  interlude oooh oooh oooh oooh oooh oooh oooh oooh whoa   well i care i know you don't care too much but i still care baby oh i care i know you don't care too much but i still care baby   i still care i still care i still care
75,Beyoncé,Roc,Unreleased Songs ,nan,nan,oh oh oh i oh oh oh i   if i wrote a book about were we stand then the title of my book would be life with superman that's how you make me feel i count you as a privilege this love is so ideal i'm honored to be in it i know you feel the same i see it everyday in all the things you do in all the things you say   you are my rock baby you're the truth you are my rock i love to rock with you you are my rock you're everything i need you are my rock so baby rock with me i wanna kiss you feel you please you just fine i wanna touch you love you baby all night reward you for all the things you do you are my rock i love to rock with you i love to rock with you  oh oh oh i   if i were to try to count the ways to make me smile i'd run out of fingers before i run out of timeless things to talk about sugar you keeps it going on make me wanna keep my loving strong make me wanna try my best to give you what you want and what you need give you my whole heart not just a little piece more than a minimum i'm talking everything more than a single wish  i'm talking every dream   you are my rock baby you're the truth you are my rock i love to rock with you you are my rock you're everything i need you are my rock so baby rock with me i wanna kiss you feel you please you just fine i wanna touch you love you baby all night reward you for all the things you do you are my rock i love to rock with you i love to rock with you   if there's options i don't want them they're not worth my time cause if it's not you oh no thank you i like us just fine you're a rock in a sand you're a smile in a cry you're my joy through the pain you're the truth through the lies no matter what i do i know that i can count on you  oh oh oh i oh oh oh i
76,Beyoncé,Signs,Dangerously In Love,2003,2003-07-23,beyoncé in december every sign has its own mode i was in love with a sagittarius see the emotions he put me through from capricorns to aquarius they all got their different minds the affection of a virgo which sign matches good with mine   beyoncé i was in love with a sagittarius he blew my mind he also had a flip side too much like a gemini he was freaky like a taurus the way he handled me yeah flirtatious like an aries which sign is best for me   beyoncé capricorn aquarius pisces aries taurus gemini cancer oh leo virgo libra scorpio sagittarius i love all y'all capricorn aquarius pisces aries taurus gemini cancer oh leo virgo libra scorpio sagittarius i love all y'all   beyoncé  missy elliott hey i wish he was a virgo the same sign as me and know how to show me love 'cause i've been hurt by a pisces rewind i wish he was a virgo the same sign as me and know how to show me love 'cause i've been hurt by a pisces i want him sexy like a scorpio the way he holds me close yeah sensitive as a cancer every sign from coast to coast   beyoncé capricorn aquarius pisces aries taurus gemini cancer oh leo virgo libra scorpio sagittarius i love all y'all capricorn aquarius pisces aries taurus gemini cancer oh leo virgo libra scorpio sagittarius i love all y'all   beyoncé i can't explain why i love him bossy like leo's do got game like an aquarius switch moves after he's been with you fun like a libra he stays on my mind he's so unpredictable he reminds me of every sign   beyoncé capricorn aquarius pisces aries taurus gemini cancer oh leo virgo libra scorpio sagittarius i love all y'all capricorn aquarius pisces aries taurus gemini cancer oh leo virgo libra scorpio sagittarius i love all y'all   beyoncé every sign from the first to the last ohh everyday of the month has its good and its bad everyday of the month i love you all all twelve signs capricorn aquarius pisces aries taurus gemini cancer oh capricorn aquarius pisces aries taurus gemini cancer oh capricorn aquarius pisces aries taurus gemini cancer oh    missy elliott every one of these signs you know you blowing me away no matter when you're born for sure with me you okay i love every one of y'all no matter what sign you are january to december here's my open arms   until fade beyoncé i was in love with a sagittarius i was in love with a sagittarius i was in love with a sagittarius i was in love with a sagittarius
77,Beyoncé,FIND YOUR WAY BACK,The Lion King: The Gift,2019,2019-07-19,beyoncé daddy used to take me walkin' down the street daddy used to take my hand say follow me daddy used to lead me back home all the time i got big enough to run around daddy left me outside   beyoncé he said find your way back big big world but you got it baby find your way back don't let this life drive you crazy find your way back come back home 'fore the street lights on find your way back find your way back   beyoncé daddy used to tell me look up at the stars it's been a long time but remember who you are circle of life and one day i might not make it circle of life and one day i might not make it   beyoncé but you just gotta find your way back big big world but you got it baby find your way back don't let this life drive you crazy find your way back come back home 'fore the street lights on find your way back find your way back  refrain beyoncé daddy used to teach me all my moves runnin' 'round wild had to tie my shoes itty bitty child with a smile like you wild wild child look a lot like you daddy used to teach me all my tricks runnin' 'round wild had to get my fix daddy used to teach me all my plays on a marathon have to run my race   beyoncé find your way back big big world but you got it baby find your way back don't let this life drive you crazy find your way back come back home 'fore the street lights on find your way back find your way back yeah   bankulli rikirobo roborebe mamasibo robirebi rebi skindanu dinda dundun sibirobo roborebe oroboskibo robi rebirebi skidin dadun dadun daya  refrain beyoncé daddy used to teach me all my moves runnin' 'round wild had to tie my shoes itty bitty child with a smile like you wild wild child look a lot like you daddy used to teach me all my tricks runnin' 'round wild had to get my fix daddy used to teach me all my plays on a marathon told me run my race   beyoncé find your way back
78,Beyoncé,End of Time,4,2012,2012-04-23,produced by beyoncé switch  thedream   come take my hand i won't let you go i'll be your friend i will love you so deeply i will be the one to kiss you at night i will love you until the end of time i'll be your baby now promise not to let you go love you like crazy now say you'll never let me go say you'll never let me go say say you'll never let me go hey say you'll never let me go say say you'll never let me go   take you away from here there's nothing between us but space and time i'll be your own little star let me shine in your world in your own little universe make me your girl   come take my hand i won't let you go i'll be your friend i will love you so deeply i will be the one to kiss you at night i will love you until the end of time i'll be your baby now promise not to let you go love you like crazy now say you'll never let me go say you'll never let me go say say you'll never let me go say you'll never let me go say say you'll never let me go   baby come on get up on it show me that you really want it i wanna be the one to love you baby let's go whoa let's go whoa i wanna provide this loving that you're giving i ain't frontin' in this love but can you let me love you from your head to toe whoa baby let's go whoa   boy come to me come to me let me turn your rain into sun come to me baby you don't have to worry baby oh no i promise i'll set your heart free let my love into your soul you go i go we go that's all she wrote  breakdown say you'll say say say you'll nev never say you'll say say say you'll nev never say you'll say say say you'll nev never say you'll say say say you'll nev never can't you see babe say you'll say say say you'll nev never say you'll say say say you'll nev never i just wanna love you say you'll say say say you'll nev never say you'll say say say you'll nev never can't you feel me babe say you'll say say say you'll nev never say you'll say say say you'll nev never i just wanna be with you i just wanna live for you i'll never let you go free your love to me   come take my hand i won't let you go i'll be your friend i will love you so deeply i will be the one to kiss you at night you at night i will love you until the end of time i'll be your baby now promise not to let you go love you like crazy now say you'll never let me go say you'll never let me go say say you'll never let me go say you'll never let me go say say you'll never let me go
79,Beyoncé,Schoolin’ Life,4,2011,2011-06-28,this is for them 0somethings time really moves fast you were just sixteen this is for them 0somethings that didn't turn out exactly how your mom and dad wanted you to be this is for them 40somethings well raise up your glass and laugh like a motherfucker this is for them 50somethings hell you're halfway there baby take it to the head  refrain mom and dad tried to hide the world said the world's just too big for a little girl eyes wide open can't you see i had my first heels by the age of  mom and dad tried to hide the boys i swear that just made 'em want me more at 4 they asked me what i wanna be i said baby  so i get me a drink   i'm not a teacher babe but i can teach you somethin' not a preacher but we can pray if you wanna ain't a doctor but i can make you feel better but im great at writing physical love letters i'm a freak all day all night hot top flight boy i'm out of sight and im crazy all day all night who needs a degree when you're schoolin' life uhoh uhoh whoaohoh uhoh uhoh whoaohoh schoolin life uhoh uhoh whoaohoh uhoh uhoh whoaohoh schoolin life   this is for them pretty somethings living in the fast lane see you when you crash babe this is for them sexy somethings that body ain't gon' always get you out of everything this is for them bitter somethings stop living in regret baby it's not over yet and this is for them chipper somethings that's high on life baby put me on your flight   i'm not a teacher babe but i can teach you somethin' not a preacher but we can pray if you wanna ain't a doctor but i can make you feel better but im great at writing physical love letters i'm a freak all day all night hot top flight boy i'm out of sight and im crazy all day all night who needs a degree when you're schoolin' life uhoh uhoh whoaohoh uhoh uhoh whoaohoh schoolin life uhoh uhoh whoaohoh uhoh uhoh whoaohoh schoolin life   you know it costs to be the boss one day you'll run the town for now make your life what you decide baby party 'til the fire marshals shut this sucks down   i'm not a teacher babe but i can teach you somethin' not a preacher but we can pray if you wanna ain't a doctor but i can make you feel better but im great at writing physical love letters i'm a freak all day all night hot top flight boy i'm out of sight and im crazy all day all night who needs a degree when you're schoolin' life uhoh uhoh whoaohoh who needs a degree when you're schoolin' life uhoh uhoh whoaohoh uhoh uhoh whoaohoh who needs a degree when you're schoolin' life uhoh uhoh whoaohoh   there's not a real way to live this for real just remember to stay relentless oh yeah oh yeah don't stop running until it's finished yeah yeah it's up to you the rest is unwritten hey hey hey
80,Beyoncé,Wake Up,Unreleased Songs ,nan,nan,beyoncé i don't wanna wake wake   beyoncé excuse me um i love you who starts a conversation like that nobody but i do but you are not a picture i can't cut you up or hide you i'll get you out my mind hmm i try to why you in my dreams i knew you knew how to be there you knew how to treat it you knew how to keep it i wanna do more than touch you i'm tryna turn two single people into a couple what's your next month like tell me what you up to we can leave right now nigga you don't need a duffle la perla provocateur of secrets how is it a secret if i know you're gonna peep it i see you peeking don't wanna hear a peep wait   beyoncé  pharrell williams before you speak don't move 'cause i don't wanna wake up wake up wake up wake up don't wanna wake up oh wake up wake up wake up you're such a dream if you can believe boy you're such a dream to me yeah yeah   beyoncé hey there boy i love you i'm feeling like i know you i can't help but wanna thug you i'm watching all these broads trying so damn hard but i can't even blame 'em 'cause you're so irresistible i want to stand and yell i won't ever dare to tell i think i heard some wedding bells keep that to yourself is this real ooh child i can stop praying now past life let's rewind to the day when i met you throwback dear god how could i forget you your sex boy it feels just like a dream to me now   beyoncé  pharrell williams before you speak don't move 'cause i don't wanna wake up wake up wake up wake up don't wanna wake up oh wake up wake up wake up you're such a dream you're such dream if you can believe boy you're such a dream to me yeah yeah   beyoncé so to whom it may concern please don't disturb me can't you see i'm happy happily sleep yeah   beyoncé  pharrell williams before you speak don't move 'cause i don't wanna wake up wake up wake up wake up i don't wanna wake up oh wake up wake up wake up you're such a dream you're such dream if you can believe boy you're such a dream to me yeah yeah   beyoncé  blue ivy baby noises ma ma ma ma don't mess with my baby they better not mess with my baby
81,Beyoncé,Check on It (LP Version),Speak My Mind (Mixtape),2006,2006-09-04,swizz beatz  slim thug swizz beatz dc destiny child slim thug   slim thug you need to stop playing 'round with all them clowns and the wankstas good girls gotta get down with the gangsta's go 'head girl put some back and some neck up on it while i stand up in the background and check up on it   beyoncé ooh boy you looking like you like what you see won't you come over and check up on it i'ma let you work up on it ladies let 'em check up on it watch it while he check up on it dip it pop it twerk it stop it check on me tonight   beyoncé if you got it flaunt it boy i know you want it while i turn around you watch me check up on it ooh you watchin' me shake it i see it in ya face ya can't take it it's blazin' you watch me in amazement you can look at it as long as you don't grab it if you don't go braggin' i might let you have it you think that i'm teasin' but i ain't got no reason i'm sure that i can please ya but first i gotta read you   beyoncé ooh boy you looking like you like what you see won't you come over and check up on it i'ma let you work up on it ladies let 'em check up on it watch it while he check up on it dip it pop it twerk it stop it check on me tonight ooh boy you looking like you like what you see won't you come over and check up on it i'ma let you work up on it ladies let 'em check up on it watch it while he check up on it dip it pop it twerk it stop it check on me tonight   beyoncé i can tell you wanna taste it but i'ma make you chase it you've got to be patient i like my men patient more patience you take my get you in more places you can't be abrasive has to know to pace it if i let you get up on it you gotta make a promise that you gon' put it on me like no one's put it on me don't bore me just show me all men talk but don't please i can be a tease but i really wanna please you   beyoncé ooh boy you looking like you like what you see won't you come over and check up on it i'ma let you work up on it ladies let 'em check up on it watch it while he check up on it dip it pop it twerk it stop it check on me tonight ooh boy you looking like you like what you see won't you come over and check up on it i'ma let you work up on it ladies let 'em check up on it watch it while he check up on it dip it pop it twerk it stop it check on me tonight  4 slim thug i'm checking on you boo do what you do and while you dance i'ma glance at this beautiful view to keep my hands in my pants i need to glue 'em with glue i'm in a trance all eyes on you and your crew me and my man's don't dance but to feel y'all bump and grind it won't hurt if you gon' try one time they all hot but let me see this one's mine it's slim thuga and dc outta htown   beyoncé ooh boy you looking like you like what you see yeah yeah won't you come over and check up on it i'ma let you work up on it all my ladies ladies let 'em check up on it watch it while he check up on it dip it pop it twerk it stop it check on me tonight yeah check on it check on it check on it check on it ooh boy you looking like you like what you see won't you come over and check up on it i'ma let you work up on it ladies let 'em check up on it watch it while he check up on it dip it pop it twerk it stop it check on me tonight hey ooh boy you looking like you like what you see won't you come over and check up on it you so sexy boy i'ma let you work up on it ladies let 'em check up on it watch it while he check up on it and i know you want it dip it pop it twerk it stop it check on me tonight so baby check up on me ooh boy you looking like you like what you see he having such a good time won't you come over and check up on it i'm gonna work it baby you're mine i'ma let you work up on it ladies let 'em check up on it watch it while he check up on it all mine all mine dip it pop it twerk it stop it check on me tonight
