,Artist,Title,Album,Year,Date,Lyric
293,Beyoncé,Wishing On A Star (Remix),Speak My Mind (Mixtape),nan,nan,i'm wishing on a star to follow where you are i'm wishing on a dream to follow what it means  check it out you can catch me on top now playin a club throwin a shot down tryin to stay above ground another groundbreakin day in the club surrounded by my home thoughts playin a cut reminesin on days i didn't have a pot to piss in no watches to glisin no v's with hot systems missin my homies that passed right in front of my eyes due to the fast life we told wonderful lies on how we would live forever time proved us wrong had to get our shit together and move it along had dreams of being big niggas jig niggas drivin the hottest cars movin out with our moms and i'm  wishing on a star to follow where you are i'm wishing on a dream to follow what it means  was interuppted by this chicken that i used to cluck wit back in the days when i was movin much shit what up chick maintanin it's the same old thang a little stress a little bullshit ain't too much changed i see you kept it movin you see i kept improving she nodded her head in agreement remember when i used to walk up and down the cement puttin it down while the streets is watchin stay hooded down just to earn a rep but what good is it now she said damn i just stopped to say hi bye i was too deep for you from day one thats why we never had relations continued in my own zone  i'm wishing on a star to follow where you are i'm wishing on a dream to follow what it means and i wish on all the rainbows that i see i wish on all the people who really dream and i'm wishing on tomorrow praying it will come and i'm wishing on all the loving we've ever done  uh huh we used to play taptap for rap tracks run catch and kiss in the back park until it got dark wanted to be like the older fellas sneak and drink old chample dangerous games we played on the third rail fiend for the summer breeze hopped out the lee's dungrares into the hawaiian shorts relying on sports to take us away from here but i cut too much so i had a plan b used to rhyme with a brush my sinners used to back me up like doug e fresh and ricky d eric mickey and me all my niggas is you with me each of ya'll let's reach for the stars now jigga  i'm wishing on a star to follow where you are i'm wishing on a dream to follow what it means and i wish on all the rainbows that i see i wish on all the people who really dream and i'm wishing on tomorrow praying it will come and i'm wishing on all the loving we've ever done
294,Beyoncé,Beyoncé.com Homepage Message,,2016,2016-07-07,we are sick and tired of the killings of young men and women in our communities  it is up to us to take a stand and demand that they stop killing us  we don't need sympathy we need everyone to respect our lives  we're going to stand up as a community and fight against anyone who believes that murder or any violent action by those who are sworn to protect us should consistently go unpunished  these robberies of lives make us feel helpless and hopeless but we have to believe that we are fighting for the rights of the next generation for the next young men and women who believe in good  this is a human fight no matter your race gender or sexual orientation this is a fight for anyone who feels marginalized who is struggling for freedom and human rights  this is not a plea to all police officers but toward any human being who fails to value life the war on people of color and all minorities needs to be over  fear is not an excuse hate will not win  we all have the power to channel our anger and frustration into action we must use our voices to contact the politicians and legislators in our districts and demand social and judicial changes  while we pray for the families of alton sterling and philando castile we will also pray for an end to this plague of injustice in our communities  click in to contact the politicians and legislators in your area your voice will be heard  beyoncé
295,Beyoncé,When You Wish Upon a Star,The Disney Family Singalong,2020,2020-04-16,verse when you wish upon a star makes no difference who you are anything your heart desires will come to you if your heart is in your dream no request is too extreme when you wish upon a star as dreamers do
296,Beyoncé,Halo - Gomi Club Remix,,nan,nan,remember those walls i built well baby they're tumbling down and they didn't even put up a fight they didn't even make a sound i found a way to let you in but i never really had a doubt standing in the light of your halo i've got my angel now it's like i've been awakened every rule i had you breakin' it's the risk that i'm takin' i ain't never gonna shut you out everywhere i'm looking now i'm surrounded by your embrace baby i can see your halo you know you're my saving grace you're everything i need and more it's written all over your face baby i can feel your halo pray it won't fade away i can feel your halo halo halo i can see your halo halo halo i can feel your halo halo halo i can see your halo halo halo woah hit me like a ray of sun burning through my darkest night you're the only one that i want think i'm addicted to your light i swore i'd never fall again but this don't even feel like fallin' gravity can't forget to pull me back to the ground again it's like i've been awakened every rule i had you breakin' the risk that i'm takin' i'm never gonna shut you out everywhere i'm looking now i'm surrounded by your embrace baby i can see you halo you know you're my saving grace you're everything i need and more it's written all over your face baby i can feel your halo pray it won't fade away i can feel your halo halo halo i can see your halo halo halo i can feel your halo halo halo i can feel your halo halo halo i can see your halo halo halo i can feel your halo halo halo halooooo ouuuu halooooo ouuuu halooooo ouuuu ouuuuu ouuuuu ouuuuu everywhere i'm looking now i'm surrounded by your embrace baby i can see you halo you know you're my saving grace you're everything i need and more it's written all over you face baby i can feel your halo pray it won't fade away i can feel your halo halo halo i can see your halo halo halo i can feel your halo halo halo i can see your halo halo halo i can feel your halo halo halo i can see your halo halo halo i can feel your halo halo halo i can see your halo halo halo oohhhh
297,Beyoncé,Green Light Medley (The Beyonce Experience Live),The Beyoncé Experience Live,2007,2007-11-16,give it to mama give it give it give it to mama mama give it give it to mama mama for some strange reason you done pleasin' me like it's okay like a perm that's been left too long it's starts to burn the result is it just won't take i can see now it's all coming so clear to me now i can see misinterpreted all my naiveness was just thinking if i had no you than i can't do my stock just went up over  million so if you want to you got the green light so if you want to you got the green light so if you want to you got the green light so if you want to you got the green light give it to mama go go go go go go go go go go go go go go red light green light some see me say i should be trophied 'cause it gets no stronger ladies y'all know yeah girl y'all know this pimp ish gets no older is that a threat what's another threat yep that's another threat from you you can get no colder you got the green light you lookin' right you holdin' up traffic green means go go go go go go go go go go go go go go go red light green light i said you're holdin' up traffic green means go so if you want to you got the green light so if you want to you got the green light so if you want to you got the green light so if you want to you got the green light give it to mama go go go go ain't no problem you can go i'm gon' find somebody else go go go go so why not move along you got the green light so you can go go go go go go go red light green light i gave all i could give to my love my heart now we're facing the end of what you did from the start my love you're holdin' up traffic green means go so if you want to you got the green light so if you want to you got the green light so if you want to you got the green light so if you want to you got the green light give it to mama go go go go ain't no problem you can go i'm gon' find somebody else go go go go so why not move along you got the green light so you can go go go go go go go red light green light
298,Beyoncé,Best Thing I Never Had (Lars B Remix),4: The Remix - EP,nan,nan,what goes around comes back around hey what goes around comes back around hey what goes around comes back around hey what goes around comes back around hey what goes around comes back around hey what goes around comes back around hey my baby what goes around comes back around hey my baby what goes around comes back around hey   there was a time i thought that you did everything right no lies no wrong boy i must've been out of my mind  pre  so when i think of the time that i almost loved you you showed your ass and i i saw the real you thank god you blew it thank god i dodged the bullet i'm so over you so baby good looking out    i wanted you bad i'm so through with that 'cause honestly you turned out to be the best thing i never had you turned out to be the best thing i never had and i'm gon' always be the best thing you never had oh i bet it sucks to be you right now   so sad you're hurt boo hoo oh did you expect me to care you don't deserve my tears i guess that's why they ain't there  pre  to i think that there was a time that i almost loved you you showed your ass and baby yes i saw the real you thank god you blew it thank god i dodged the bullet i'm so over you baby good looking out    i wanted you bad i'm so through with that 'cause honestly you turned out to be the best thing i never had i said you turned out to be the best thing i never had and i'll never be the best thing you never had oh baby i bet it sucks to be you right now   i know you want me back it's time to face the facts that i'm the one that's got away lord knows that it would take another place another time another world another life thank god i found the good in goodbye    i used to want you so bad i'm so through with that 'cause honestly you turned out to be the best thing i never had oh you turned out to be the best thing i never had and i will always be the best thing you never had ooh best thing you never had i used to want you so bad i'm so through with that 'cause honestly you turned out to be the best thing i never had oh you turned out to be the best thing i never had ooh i will never be the best thing you never had oh baby i bet it sucks to be you right now   what goes around comes back around what goes around comes back around what goes around comes back around what goes around comes back around what goes around comes back around what goes around comes back around what goes around comes back around what goes around comes back around what goes around comes back around  what goes around comes back around hey what goes around comes back around hey what goes around comes back around hey what goes around comes back around hey what goes around comes back around hey what goes around comes back around hey what goes around comes back around hey what goes around comes back around hey
299,Beyoncé,Diva (Karmatronic Club Remix),Above and Beyoncé - Dance Mixes,nan,nan,hey hey hey  refrain nanana diva is a female version of a hustla of a hustla of a of a hustla nanana diva is a female version of a hustla of a hustla of a of a hustla   stop the track lemme state facts i told you gimme a minute and i'll be right back fifty million 'round the world and they say that i couldn't get it i done got so sick and filthy with benjis i can't spend it how you gon' be talkin' shit you act like i just got up in it been the number one diva in this game for a minute i know you read the paper  the one that they call the queen every radio 'round the world know me cause that's where i be first   i'm aa diva hey i'm a i'm aa diva hey i'm a i'm aa diva hey i'm a i'm aa diva i'm a i'm aa diva hey i'm a i'm a a diva i'm a i'm a a diva hey i'm a i'm a a di  refrain nanana diva is a female version of a hustla of a hustla of a of a hustla nanana diva is a female version of a hustla of a hustla of a of a hustla   when he pull up wanna pop my hood up bet he better have a sixpack in the cooler gettin' money divas gettin' money if you ain't gettin' money then you ain't got nothin' fo' me tell me somethin' tell me somethin' where yo boss at where yo' boss at where my ladies up in here that like to talk back that like to talk back i wanna see her i wanna see her i'd like to meet ya i'd like to meet her what you say not to me she ain't no diva she ain't no diva   nanana diva is a female version of a hustla of a hustla of a of a hustla nanana diva is a female version of a hustla of a hustla of a of a hustla   since 5 in my stilettos been struttin' in this game what's yo age was the question they ask when i hit the stage i'm a diva best believe her you see how she gettin paid she ain't callin' him to greet her don't need him her bed's made this is a stickup stickup i need them bags all that money we're gonna stickup stickup you see them ask where that money  all my ladies get it up i see you i do the same take it to another level no passengers on my plane   hey hey hey this is a stickup stickup hey i need them bags all that money stickup stickup hey you see the mask where that money    nanana diva is a female version of a hustla of a hustla of a of a hustla nanana diva is a female version of a hustla of a hustla of a of a hustla  refrain   i'm a i'm aa diva i'm a i'm aa diva i'm a i'm aa diva i'm a i'm aa diva i'm a i'm aa diva i'm a i'm aa diva i'm a i'm aa diva i'm a i'm aa diva i'm a i'm aa diva i'm a i'm aa diva
300,Beyoncé,Suga Mama (Remix),,2007,2007-07-16,beyoncé  consequence damn that was so good i wanna buy him a short set uh uh cha'ya uh uh it's the cons' fool wor' wor' wor'   consequence i punch out hits like sugar shane the new suga the game and ain't nothin' sweeter by him or suger canes i move suger queen bought them 6 inch heels and gotta feelin' like she livin' on the top of suger hills and paid suger bills now she calls me suga daddy cause i come through stunt in that suga white cady bubble brown suga body angelo and los angeles with a badda chick now she mad at quence cause of the game i run so she wanna chew me out like suga the gum but competition is nothin' so you really can't see me cause suga i'm on a level that higher then don bredes so you can eat your wheaties pop some suger smacks or sweeten up your coffee with dozen of suger packs you still ain't no match for kid from melby when they sprinkle the club with more gees and suga tee and yes indeed he gots to be the all topsy that killed the summer in that drop top b so on the close n' open' forget the rope n' dough cause suga ain't knock em out with the dopest quotes uh uh   beyoncé ima be like a jolly rancher that you get from the corner store ima be like a waffle cone thats dripping down to the floor the way you do if for me i cant lie lie about to be up in the mall all night yes whatever i get you putting it on yes dont give me no lip let mama do it all  hook beyoncé let me be i wants to be gots to be your suga give mama some suga mama suga mamamama suga mama im your suga mama suga mama let me be i wants to be gots to be gots to be new whip new heavy on the wrist cause im a suga mamamama im your suga mama suga mama   beyoncé hey hey sit on mama lap hey hey come sit on mama lap hey come sit on mama lap hey hey come sit on mama lap hey   beyoncé its so good to the point that id do anything to keep you home baby what you want me to buy my accountants waiting on the phone on the phone just the thought of making love to you you dropping everything thats what ill do i'll do whatever i get you putting it on boy now take it off while i watch you perform  hook beyoncé let me be i wants to be gots to be your suga give mama some suga mama suga mamamama suga mama im your suga mama suga mama let me be i wants to be gots to be gots to be new whip new heavy on the wrist cause im a suga mamamama im your suga mama suga mama cause im a suga mamamama im your suga mama suga mama   beyoncé hey hey sit on mama lap hey hey come sit on mama lap hey come sit on mama lap hey hey come sit on mama lap hey  breakdown beyoncé and ive always been the type to take care of mine i know just what im doing dont you worry its cool and everything is steady claimed you on my taxes already yeah yeah yeah yeah i promise i wont let no bills get behind cause every touch every kiss and hug you bes believe itll be on time suga mama mama mama yeah yeah yeah  hook beyonce with adlibs let me be i wants to be gots to be your suga give mama some suga mama give you all my money baby suga mamamama suga mama im your suga mama suga mamaturn me out boy somthin' crazy let me be i wants to be gots to be take my credit card the key to my housegots to be new whip new heavy on the wrist take my car cause im a suga mamamama don't look and tokin' mama some suga im your suga mama suga mama suga before you walk out that door   beyonce hey hey sit on mama lap yes hey hey come sit on mama lap yes hey come sit on mama lap yeaaaeeah hey hey come sit on mama lap hey yeah yeah hey hey sit on mama lap yes hey hey come sit on mama lap yes hey come sit on mama lap yeaaaeeah hey hey come sit on mama lap hey yeah yeah
301,Beyoncé,Deja Vu (No Rap Version)‎,,nan,nan,beyoncé  jayz bass hihat 808 let's go get 'em   beyoncé baby seem like everywhere i go i see you from your eyes i smile it's like i breathe you helplessly i reminisce don't want to compare nobody to you  prehook beyoncé boy i try to catch myself but i'm outta control your sexiness is so appealing i can't let it go  hook beyoncé know that i can't get over you 'cause everything i see is you and i don't want no substitute baby i swear it's déjà vu know that i can't get over you 'cause everything i see is you and i don't want no substitute baby i swear it's déjà vu   beyonce seeing things that i know can't be am i dreaming when i saw you walkin' past me almost called your name got a better glimpse and then i looked away feels like i'm losing it  prehook beyoncé boy i try to catch myself but i'm outta control your sexiness is so appealing i can't let it go  hook beyoncé know that i can't get over you 'cause everything i see is you and i don't want no substitute baby i swear it's déjà vu know that i can't get over you 'cause everything i see is you and i don't want no substitute baby i swear it's déjà vu  4 jayz yes   beyoncé baby i can't go anywhere without thinking that you're there seems like you're everywhere it's true gotta be having deja vu 'cause in my mind i want you here get on the next plane i don't care is it because i'm missin' you that i'm having déjà vu  prehook beyoncé boy i try to catch myself but i'm outta control your sexiness is so appealing i can't let it go  hook beyoncé know that i can't get over you 'cause everything i see is you and i don't want no substitute baby i swear it's déjà vu know that i can't get over you 'cause everything i see is you and i don't want no substitute baby i swear it's déjà vu know that i can't get over you 'cause everything i see is you and i don't want no substitute baby i swear it's déjà vu know that i can't get over you cause everything i see is you and i don't want no substitute baby i swear it's déjà vu
302,Beyoncé,Crazy In Love (The Beyonce Experience Live),The Beyoncé Experience Live,2007,2007-11-16,jayz  beyoncé yes it's so crazy right now most incredibly it's your girl b it's your boy young you ready   beyoncé uh oh uh oh uh oh oh no no uh oh uh oh uh oh oh no no uh oh uh oh uh oh oh no no uh oh uh oh uh oh oh no no  interlude jayz it's history in the making part two it's so crazy right now   beyoncé i look and stare so deep in your eyes i touch on you more and more every time when you leave i'm begging you not to go call your name two or three times in a row such a funny thing for me to try to explain how i'm feeling and my pride is the one to blame cause i know i don't understand just how your love can do what no one else can   beyoncé got me looking so crazy right now your love's got me looking so crazy right now your love got me looking so crazy right now your touch got me looking so crazy right now your touch got me hoping you'll page me right now your kiss got me hoping you'll save me right now looking so crazy your love's got me looking got me looking so crazy your love   beyoncé uh oh uh oh uh oh oh no no uh oh uh oh uh oh oh no no uh oh uh oh uh oh oh no no uh oh uh oh uh oh oh no no   beyoncé when i talk to my friends so quietly who he think he is look at what you did to me tennis shoes don't even need to buy a new dress if you ain't there ain't nobody else to impress it's the way that you know what i thought i knew it's the beat that my heart skips when i'm with you but i still don't understand just how the love your doing no one else can   beyoncé got me looking so crazy right now your love's got me looking so crazy right now your love got me looking so crazy right now your touch got me looking so crazy right now your touch got me hoping you'll page me right now your kiss got me hoping you'll save me right now looking so crazy your love's got me looking got me looking so crazy your love i'm looking so crazy your love's got me looking got me looking so crazy your love   jayz check it let's go young hov y'all know when the flow is loco young b and the roc uh oh oh og big homie the one and only oh no stick bony but the pockets is fat like tony soprano oh no the roc handle like van exel i shake phonies man you can't get next to the genuine article i do not sing though i sling though if anything i bling yo a star like ringo war like a green beret crazy bring ya whole set jay z in the range crazy and deranged they can't figure him out they like hey is he insane oh no yes sir i'm cut from a different cloth my texture is the best fur chinchilla i've been iller than chain smokers how you think i got the name hova i been realer the game's over fall back young ever since i made the change over to platinum the game's been a wrap one  4 beyoncé got me looking so crazy my baby i'm not myself lately i'm foolish i don't do this i've been playing myself baby i don't care cause your love's got the best of me and baby you're making a fool of me you got me sprung and i don't care who sees cause baby you got me you got me so crazy baby hey   beyoncé got me looking so crazy right now your love's got me looking so crazy right now your love got me looking so crazy right now your touch got me looking so crazy right now your touch got me hoping you'll page me right now your kiss got me hoping you'll save me right now looking so crazy your love's got me looking got me looking so crazy your love got me looking so crazy right now your love's got me looking so crazy right now your love got me looking so crazy right now your touch got me looking so crazy right now your touch got me hoping you'll page me right now your kiss got me hoping you'll save me right now looking so crazy your love's got me looking got me looking so crazy your love
303,Beyoncé,Listen (Live),I Am... World Tour,nan,nan,listen to the song here in my heart a melody i start but can't complete listen to the sound from deep within its only beginning to find release  pre oh the time has come for my dreams to be heard they will not be pushed aside and turned into your own all 'cause you won't listen   listen i am alone at a crossroads im not at home in my own home and i've tried and tried to say what's on my mind you should have known oh now i'm done believin' you you don't know what i'm feelin' im more than what youve made of me i followed the voice you gave to me but now i've gotta find my own you should have listened   there was someone here inside someone i thought had died so long ago  pre oh im screamin' out and my dreams will be heard they will not be pushed aside or turned into your own all 'cause you won't listen   listen i am alone at a crossroads im not at home in my own home and i've tried and tried to say what's on my mind you should have known oh now i'm done believin' you you don't know what i'm feelin' i'm more than what you've made of me i followed the voice you gave to me but now i've gotta find my own   i don't know where i belong but i'll be moving on if you don't if you won't   listen to the song here in my heart a melody i start but i will complete now i'm done believin' you you don't know what i'm feelin' i'm more than what you made of me i followed the voice you think you gave to me but now i've gotta find my own my own
