,Artist,Title,Album,Year,Date,Lyric
170,Beyoncé,Drunk in Love (Homecoming Live),HOMECOMING: THE LIVE ALBUM,2019,2019-04-17,beyoncé i've been drinkin' i've been drinkin' get filthy when that liquor get into me i've been thinkin' i've been thinkin' why can't i keep my fingers off it baby i want you nownow why can't i keep my fingers off it baby i want you nownow coachella i wanna hear y'all sing cigars on ice cigars on ice feelin' like an animal with these cameras all in my grill flashin' lights flashin' lights you got me faded faded faded baby i want you nownow can't keep your eyes off my fatty daddy i want you drunk in love how y'all doin' over here i want you  pre beyoncé we woke up in the kitchen saying how the hell did this shit happen oh baby i can see you all the way all the way back there we be all night last thing i remember is our beautiful bodies grindin' up in that club drunk in love sing it y'all   beyoncé we be all night sing come on sing we be all night sing hey   beyoncé we be all night and everything all right no complaints 'cause my body so fluorescent under these lights boy i'm drinkin' park it in my lot 7eleven i'm rubbin' on it rubrubbin' if you scared call that reverend boy i'm drinkin' get my brain right armand de brignac gangster wife louis sheets he sweat it out like washrags he wet it up boy i'm drinkin' i'm singin' on the mic 'til my voice hoarse then i fill the tub up halfway then ride it with my surfboard surfboard surfboard grainin' on that wood grainin'grainin' on that wood wood i'm swervin' on his swerveswervin' on his big body benz surfin' all on his surfs up good good  pre beyoncé hey last thing i remember is our beautiful bodies grindin' up in that club drunk in love   beyoncé we be all night sing it hey we be all night   beyoncé  fast life yungstaz ride it with my surfboard man i got that swag surfboard surfboard my hat matchin' my bag grainin' on that wood grainin'grainin' on that wood you know i'm poppin' tags i'm swervin' on his swerveswervin' on his big body benz and man i got that swag ahh you  dance break fast life yungstaz i swag when i surf i swag when i surf i swag when i surf now watch me surf and swag i swag when i surf i swag when i surf i swag when i surf now watch me surf and swag   beyoncé surfboard surfboard surfboard grainin' on that wood grainin'grainin' on that wood swervin' on his swerveswervin' on his big body benz surfin' all on his surfsurfin' all on his good good   to the left to the left everything you own in the box to the left sing it to the left to the left everything you own in the box to the left say i'm aa diva sing it i'm aa diva say i'm aa diva sing it i'm aa diva louder i'm aa diva louder i'm aa diva can't hear you i'm aa diva sing it i'm aa diva come on
171,Beyoncé,Don’t Hurt Yourself (Homecoming Live),HOMECOMING: THE LIVE ALBUM,2019,2019-04-17,who the fuck do you think i is you ain't married to no average bitch boy you can watch this fat ass twist boy as i bounce to the next dick boy and keep your money i got my own keep a bigger smile on my face being alone bad motherfucker god complex ill motivate your ass call me malcolm x your operator innovator fuck you hater you can't recreate her no haha you'll never recreate her no hell no uh  refrain you just gotta let it be let it be let it be let it be baby oh you just gotta let it be let it be let it be let it be baby   you hurt yourself dont hurt yourself when you play me you play yourself don't play yourself when you lie to me you lie to yourself you're only lying to yourself when you hurt me you hurt yourself don't hurt yourself  refrain you just gotta let it be let it be let it be let it be baby hey baby   who the fuck do you think i is i smell that fragrance on your louis knit boy just give this fat ass a big kiss boy tonight i'm fucking up all your shit boy   the most disrespected person in america is the black woman i am the dragon breathing fire the most unprotected person in america is the black woman beautiful mane i'm the lion the most neglected person in america is the black woman beautiful man i know you're lying   this is your final warning don't hurt yourself you know i give you life dont hurt yourself if you try this shit again dont hurt yourself you gon' lose your wife  nonlyrical vocal
172,Beyoncé,Back Up,B’Day (Deluxe Edition),2006,2006-09-04,when you see that girl comin' back up she ain't yo' average chickback up this is for the the the club and this is for the people on the the the block when you see that girl comin' back up she ain't yo average chickback up this is for the the the club and this is for the people on the the the block she ain't the average chick she the baddest chick she ain't the average chick she the baddest chick   everybody know that face even with her head low they still know that shape when she come through the club people take they place chicks throwin' handcuffs 'cause they knowin' that they man ain't safe  pre 'cause she the one switchin' up flows if it's four door two gotta go chicks like what kinda jeans is those and fellas watchin' like please get low   when you see that girl comin' back up she ain't yo' average chickback up this is for the the the club and this is for the people on the the the block when you see that girl comin' back up she ain't yo average chickback up this is for the the the club and this is for the people on the the the block she ain't the average chick she the baddest chick she ain't the average chick she the baddest chick   everybody can't do this some ain't gotta clue till they hear me spit achoo i spew 'cause yo' girl is sick is it the change or the hipsyou can't tell but you know it's thick  pre 'cause she the one switchin' up flows if it's four door two gotta go chicks like what kinda jeans is those and fellas watchin' like please get low   when you see that girl comin' back up she ain't yo' average chickback up this is for the the the club and this is for the people on the the the block when you see that girl comin' back up she ain't yo average chickback up this is for the the the club and this is for the people on the the the block she ain't the average chick she the baddest chick she ain't the average chick she the baddest chick   for this type of girl it's not that hard you see her 'cause she too far gone though they pray and pray for her downfall why they gotta be so envious doin' what it do fit to be a plus hey hey hey hey hey hey hey back up back up   when you see that girl comin' back up she ain't yo' average chickback up this is for the the the club and this is for the people on the the the block when you see that girl comin' back up she ain't yo average chickback up this is for the the the club and this is for the people on the the the block she ain't the average chick she the baddest chick she ain't the average chick she the baddest chick   hey hey hey hey hey hey hey hey hey hey hey hey hey back it up now whoa whoa whoa whoa whoa
173,Beyoncé,Amor Gitano,B’Day (Deluxe Edition),2006,2006-09-04,letra de amor gitano ft alejandro fernández  verso  beyoncé  alejandro fernández ven y quédate conmigo dame el corazón vida mía estoy muriendo lento en mi prisión anda dime lo que sientes quitate el pudor y deja de sufrir escapa con mi amor y después te llevare hasta donde quieras sin temor y sin fronteras hasta donde sale el sol contigo soy capaz de lo que sea no me importa lo que venga porque ya se a donde voy  coro alejandro fernández  beyoncé soy tu gitano tu peregrino la única llave de tu destino el que te cuida más que a su vida soy tu ladrón soy tu gitana tu compañera la que te sigue la que te espera voy a quererte aunque me saquen el corazón y aunque nos cueste la vida y aunque duela lo que duela esta guerra la ha ganado nuestro amor esta guerra la ha ganado nuestro amor  verso  beyoncé  alejandro fernández yo nací para tus ojos para nadie más siempre voy a estar en tu camino alma de mi alma corazón de tempestad dime por donde ir y después te llevare hasta donde quiera sin temor y sin fronteras hasta donde sale el sol contigo soy capaz de lo que sea no me importa lo que venga porque ya se a donde voy  coro alejandro fernández  beyoncé soy tu gitano tu peregrino la única llave de tu destino el que te cuida más que a su vida soy tu ladrón soy tu gitana tu compañera la que te sigue la que te espera voy a quererte aunque me saquen el corazón y aunque nos cueste la vida y aunque duela lo que duela esta guerra la ha ganado nuestro amor y aunque nos cueste la vida y aunque duela lo que duela esta guerra la ha ganado   alejandro fernández  beyoncé nuestro amor
174,Beyoncé,Yoncé (Homecoming Live),HOMECOMING: THE LIVE ALBUM,2019,2019-04-17,see me up in the club with fiftyeleven girls posted in the back diamond fangs in my grill brooklyn brim with my eyes sitting low every girl in here with me got that smoke every girl in here gotta look me up and down all on instagram cake by the pound circulate the image every time i come around g's up tell me how it's looking babe   drop the bass mane the bass get lower radio say speed it up i just go slower high like treble pumping on the mids the man ain't ever seen a booty like this so why you think ya keep my name rolling off the tongue 'cause when he wanna smash i'll just write another one i sneezed on the beat and the beat got sicker yoncé all on his mouth like liquor yoncé all on his mouth like liquor yoncé all on his mouth like liquor yoncé all on his mouth like liquor like like liquor like like like liquor
175,Beyoncé,I Care (Homecoming Live),HOMECOMING: THE LIVE ALBUM,2019,2019-04-17,i told you how you hurt me baby but you don't care now i'm crying and deserted baby but you don't care ain't nobody tell me this is love when you're immune to all my pain i need you to tell me this is love you don't care well that's okay   well i care i know you don't care too much but i still care baby oh i care i know you don't care too much but i still care baby oh   ever since you knew your power you made me cry and now every time our love goes sour you can't sympathize baby you see these tears falling down to my ear i swear you like when i'm in pain yeah i try to tell you all my fears you still don't care well that's okay listen hey   well i care i know you don't care too much but i still care baby oh i care i know you don't care too much but i still care baby   boy maybe if you cared enough i wouldn't have to care so much what happened to our trust now you're just givin' up you used to be so in love now you don't care no more  interlude ooh ooh dododo do dododo dodo dodo dodododododo ooh ooh hey   well i care i know you don't care too much but i still care baby oh i care i know you don't care too much but i still care baby   i still care baby i still care yeah i still care lalala lalala
176,Beyoncé,7/11 (Homecoming Live),HOMECOMING: THE LIVE ALBUM,2019,2019-04-17,goddamn goddamn goddamn goddamn sing it sing it in the air i know you care smack it smack it smack it smack it in the air smack it smack it in the air   wave your hands side to side put it in the air clap clap clap like you don't care smack that clap clap clap like you don't care i know you care   clap it clap it clap it clap it foot up my foot up hold up now my foot up spinnin' i'm spinnin' my foot up foot up yeah my foot up spinnin' i'm spinnin' my foot up put my foot down yeah my hands up drank   hold that cup like alcohol hold that cup like alcohol hold that cup like alcohol don't you drop that alcohol never drop that alcohol never drop that alcohol i know i'm thinkin' 'bout alcohol i know i'm thinkin' 'bout that alcohol   man this feel like rollin' dice damn this feel like rollin' dice seven eleven seven eleven seven twice man seven twice man this feel like rollin' dice damn this feel like rollin' dice man this feel like rollin' dice seven twice seven twice man i'm tryna kick it with ya damn i wanna kick it with ya man i'm tryna kick it with ya i spin around and i kick it with ya  pre shoulders sideways smack it smack it in the air legs movin' side to side smack it in the air legs movin' side to side smack it in the air shoulders movin' sidetoside smack it in the air smack it in the air smack it smack it in the air smack it in the air i know you care   wave ya hands side to side wave ya hands side to side wave ya hands from side to side wave ya hands side to side ooh wee bey be freaky deaky think me see she pink bikini rock that groovy dye dashiki nefertiti edges kinky sweatin' out my blow out sweatin' out my press this trick about to go off mad 'cause i'm so fresh fresher than you fresher than you fresher than you oh
177,Beyoncé,Hard To Say Goodbye,Dreamgirls: Music from the Motion Picture (Deluxe Edition),nan,nan,deena the dreams we didn't make forever we've each got to go our seperate way and now we're standing here helpless looking for something to say we've been together a long time we never thought it would end we were always so close to each other you were always my friend and it's hard to say goodbye my love hard to see you cry my love hard to open up that door when you're not sure what you're going for we didn't want this to happen but we shouldn't feel sad we had a good life together just remember remember all the times we had you know i'll always love you you know i'll always care and no matter i'll far i may go in my heart you'll always be there and it's hard to say goodbye my love it's so hard hard to see you cry my love it's so hard hard to open up that door when you're not sure what you're going for but we've got to grow we've got to try though it's hard so hard we've got to say goodbye we didn't make forever but i'll always love you but i'll always love you we didn't make forever but i'll always love you but i'll always love you it's so hard baby it's so hard hard
178,Beyoncé,I Can’t Take No More,Dangerously In Love,nan,nan,it's really been weighing on me tell me what did i do to have ya'll hatin on me when i don't have nothin' to prove sometimes i shake my head when i'm layin' down in my bed thinkin' 'bout the things been said when you really don't know me yet  gotta clear up some things there have been many things said about me so many opinions so many judgements preconcieved it's outta my character for me to feed in to ya give it a rest you must admire me spend so much time with me consuming your head  i can't take no more i think it's time for me to let it all out i can't take no more why my name always up in your mouth what you hate me for i'm so tired of all of these lies i can't take no more no more no more no more oooh  it's really been weighing on me i'm not myself lately i feel a little incomplete but i'm not gonna lose no sleep i keep it all in my mind cause it gotta get better in time why don't you live your life and let me live mine  gotta clear up some things there have been many things said about me so many opinions so many judgements preconcieved it's outta my character for me to feed in to ya give it a rest you must admire me spend so much time with me consuming your head  i can't take no more i think it's time for me to let it all out i can't take no more why my name always up in your mouth what you hate me for i'm so tired of all of these lies i can't take no more no more no more no more oooh  yoou yoou yoou don't know yoou yoou yoou don't know yoou yoou yoou don't know yoou yoou yoou don't know  i can't take no more i think it's time for me to let it all out i can't take no more why my name always up in your mouth what you hate me for i'm so tired of all of these lies i can't take no more no more no more no more oooh  i can't take no more i think it's time for me to let it all out i can't take no more why my name always in your mouth what you hate me for i'm so tired of all of these lies i can't take no more no more no more no more oooh  leave me alone leave me alone just leave me alone leave me alone
179,Beyoncé,Darling Nicki (Minaj),,2015,2015-10-26,beyoncé i met this girl named nicki i guess you could say she was the rap queen i met her in the studio lobby but her booty look bigger in the magazines she said bey would you jump in this song of mine how could i resist when i heard little nicki rhyme
180,Beyoncé,Move Your Body,,2011,2011-04-03,50let's move  swizz beatz whoo clap your hands now 4x jump 8x  beyoncé mission one let me see you run put your knees up in the sky cause we just begun hey hey  mission two this is how we do shuffle shuffle to right to the left let's move hey hey  mission three can you dougie with me throw your own little swag on this swizzy beat hey hey  mission four if you ready for more jump rope jump rope get your feet off the floor hey hey  i ain't worried doing me tonight a little sweat ain't never hurt nobody don't just stand there on the wall everybody just move your body  move your body 4x  everybody won't you move your body x  hey  can you get me bodied i wanna be myself tonight x  wanna move my body i wanna let it out tonight  wanna party wanna dance  wanna be myself tonight  hey  mission five come here let's go  time to move your little hips vámonos vámonos  hey hey  mission six bring it back real quick  do the running man and then turn around like this  hey hey  mission seven time to break it down  step and touch to the dancehall sound  hey hey  mission eight feel that heart beat race  snap your fingers tap your feet just keep up with this pace  hey hey  i ain't worried doing me tonight  a little sweat ain't never hurt nobody  don't just stand there on the wall  everybody just move your body  move your body 4x  everybody won't you move your body x  hey  can you get me bodied i wanna be myself tonight x  wanna move my body i wanna let it out tonight  wanna party wanna dance  wanna be myself tonight  hey  fellas on the floor all my ladies on the floor  everybody get ready to move your body  baby all i want is to let it go  ain't no worries no  we can dance all night  move your body  that means come closer to me  while we dance to the beat  move your body  now run to the left to the left to the left  now run to the left to the left  now run to the right to the right to the right  run back to the right to the right  repeat  now wave the american flag  wave the american flag x  hey  swizz beatz now cool off cool off  hey
181,Beyoncé,Proud To Be An American,,2011,2011-07-04,if tomorrow all the things were gone id worked for all my life and i had to start again with just my family by my side id thank my lucky stars to be livin' here today cause the flag still stands for freedom and they can't take that away and i'm proud to be an american where at least i know i'm free and i won't forget the men who died who gave that right to me and i gladly stand up next to you and defend her still today cause there ain't no doubt i love this land god bless the usa from the lakes of minnesota to the hills of tennessee across the plains of texas from sea to shining sea from detroit down to houston to new york to la well there's pride in every american heart and it's time to make a change that i'm proud to be an american where at least i know i'm free and i won't forget the men who died and who gave that right to me and i gladly stand up next to you and defend her still today cause there ain't no doubt i love this land god bless the usa and i'm proud to be an american where at least i know i'm free and i won't forget the men who died and who gave that right to me and i gladly stand up next to you and defend her still today cause there ain't no doubt i love this land god bless the usa
182,Beyoncé,Trust In Me,Cadillac Records: Music From the Motion Picture,2008,2008-12-02,trust in me in all you do have the faith i have in you love will see us through if only you trust in me why don't you you trust me  come to me when things go wrong cling to me daddy and oh yeah i'll be strong we can get along we can get along oh if only you trust in me  while there's a moon a moon on high while there are birds birds to fly while there is you you and i i can be sure that i love you  oh stand beside me stand beside me all the while come on daddy face the future why don't you smile trust in me and i'll be worthy of you  oh yeah yeah why don't you yeah trust in me in all you do and have the faith that i have in you oh and love will see us through if only you will trust in me yeah yeah yeah  why don't you you come to me when things go wrong cling to me oh and i'll be strong we can get along we can get along oh if only you trust in me yeah yeah yeah only if you trust in me
183,Beyoncé,Dreaming,4,2011,2011-06-24,when i'm here in your arms i feel love in my heart i can breathe not even pinching myself i don't care i'm with you you with me i never wished on the star when the star ain't got nothing on me 'cause i can wish you in my dreams  pre when i close my eyes i feel like i'm alive 'cause i can fall asleep knowing that tonight you'll be here with me ohh   let me know if this is a dream oh oh oh then i don't wanna know i don't wanna know 'cause i ain't 'bout to be without you babe without you babe ohh let me know if this is a dream oh oh oh then i ain't letting go i ain't letting go 'cause everything i love is about you babe about you babe so i'd rather be a dreamer than waking up with nobody home oh oh oh oh oh oh oh oh oh oh if that's the only way to be with you then dreaming you is where i belong oh oh oh oh oh oh oh oh oh oh   i think the luckiest girl in the whole wide world could be me i get to be with the one that i love anytime i please i feel like i can stay forever beyond eternity it's like i'm where i'm supposed to be  pre when i close my eyes i feel like i'm alive 'cause i can fall asleep knowing that tonight you'll be here with me ohh   let me know if this is a dream oh oh oh then i don't wanna know i don't wanna know 'cause i ain't 'bout to be without you babe without you babe ohh let me know if this is a dream oh oh oh then i ain't letting go i ain't letting go 'cause everything i love is about you babe about you babe so i'd rather be a dreamer than waking up with nobody home oh oh oh oh oh oh oh oh oh oh if that's the only way to be with you then dreaming you is where i belong oh oh oh oh oh oh oh oh oh oh   it took a lifetime just to get with you to be with you baby and now that i'm here with you i'm gonna take it in breathe you in yeah yeah yeah and if i am dreaming let the dream be that i'm awake 'cause i'd rather dream about you than living life without me and you you   let me know if this is a dream oh oh oh then i don't wanna know i don't wanna know 'cause i ain't 'bout to be without you babe without you babe ohh let me know if this is a dream oh oh oh then i ain't letting go i ain't letting go 'cause everything i love is about you babe about you babe so i'd rather be a dreamer than waking up with nobody home oh oh oh oh oh oh oh oh oh oh if that's the only way to be with you then dreaming you is where i belong oh oh oh oh oh oh oh oh oh oh let me know if this is a dream oh oh oh then i don't wanna know i don't wanna know 'cause i ain't 'bout to be without you babe without you babe ohh let me know if this is a dream oh oh oh then i ain't letting go i ain't letting go 'cause everything i love is about you babe about you babe so i'd rather be a dreamer than waking up with nobody home oh oh oh oh oh oh oh oh oh oh if that's the only way to be with you then dreaming you is where i belong oh oh oh oh oh oh oh oh oh oh   oh oh oh oh oh oh oh oh oh oh oh oh oh oh oh oh oh oh oh oh oh oh oh oh oh oh oh oh oh oh
