,Artist,Title,Album,Year,Date,Lyric
35,Cardi B,With That,"Gangsta Bitch Music, Vol. 1 (Promo CD)",2016,2016-03-07,hook hundred band hundred band i'm 'bout my bread i got to get this shmoney man they fuck with my shmoney i'm sending them shots i watch them do the running man i'm with the shits if a nigga want this he gon' have to buy all of that i'm with the shits if a nigga want this he gon' have to buy all of that he just want to splurge and its ok i'm so cool with that 5 thousand on a purse yeah baby boy i'm so cool with that fuck him so good he gonna want to go spend all that pussy got him on the jugg he gonna reup and come right back   no i'm not cool 'cause bitch i'm bool and i'm been jacking that ever since school so don't be a fool run up on me got mechanics with tools and they ain't scared to lose they had me on snooze now when i host it's is a zoo when the host is a zoo got me a check i got a check feeling so blessed doing a lot more than what they expect i'm in my prime everything in effect and i'm so cool with that this hustle not new to that sell out these spots got 'em thinking like who did that this new bitch from the bronx the one that you slept on for so long so cool all that cool all that  hook hundred band hundred band i'm 'bout my bread i got to get this shmoney man they fuck with my shmoney i'm sending them shots i watch them do the running man i'm with the shits if a nigga want this he gon' have to buy all of that i'm with the shits if a nigga want this he gon' have to buy all of that he just want to splurge and its ok i'm so cool with that 5 thousand on a purse yeah baby boy i'm so cool with that fuck him so good he gonna want to go spend all that pussy got him on the juug he gon' reup and come right back   he want to dab in this pussy but i don't think he get the picture he ask me what i want i tell him make me look like subzero sister i'm talking that ice just ignore the price or i might just dismiss ya don't do broke niggas ain't no joke nigga 'cause the pussy delicious bitches mad at me cause i'm on my shit i know they doubted me cause i used to strip blew on ig on some regular shit then she to tv on some degular shit when i pull up on that bitch for talking that shit amnesia kick in and i swear they forget then i think to myself they ain't fuck with my money then i keep it pushing watch out lil' bitch  hook hundred band hundred band i'm 'bout my bread i got to get this shmoney man they fuck with my shmoney i'm sending them shots i watch them do the running man i'm with the shits if a nigga want this he gon' have to buy all of that i'm with the shits if a nigga want this he gon' have to buy all of that he just want to splurge and its ok i'm so cool with that 5 thousand on a purse yeah baby boy i'm so cool with that fuck him so good he gonna want to go spend all that pussy got him on the jugg he gon' reup and come right back
36,Cardi B,Leave That Bitch Alone,"Gangsta Bitch Music, Vol. 2",2017,2017-01-20,cardi cardi b  hook leave that bitch alone leave that bitch alone you knew that i was crazy why the fuck you took her home now i'm goin' through your phone seein' all these hoes you knew that i don't like her what type of crazy shit you on   you want me to come to your crib and get comfortable what if i wanna move in and shit i will show up on some random shit don't let me catch a bitch you wanna chance that shit you should just dead it i swear to god you gon' regret it watch when i start askin' you why the fuck you take so long to answer my message the fuck you gon' tell me oh you with the homies don't even think you can curve me for some other pussy 'cause it can get ugly boy i be on some other shit just lettin' you know wassup 'cause if i ever find out 'bout that other bitch boy you gon' get that bitch cut  prehook  i'm not the one i don't know why would you try it trust me my nigga just know i will beat all of them judges i swear i'm not lyin' pussy was good pussy was perfect but watch when i pop all ya tires and key up ya whip like i hope it was worth it  hook leave that bitch alone leave that bitch alone you knew that i was crazy why the fuck you took her home now i'm goin' through your phone seein' all these hoes you knew that i don't like her what type of crazy shit you on   what if i tell you i wanna be wifey what you gon' tell me i might be then i'ma want ya password to ya twitter ya facebook and even ya ig boy it's a wrap 'cause i got the gat and i will blow all them bitches that's all in ya dms just don't call me back nigga please don't be dumb my hair always in a bun you know what that means i'll be ready for war and remember i got a gun i be on some other shit just lettin' you know from now so when that time come around and i do catch you lackin' move outta town  prehook  i'm tellin' you i don't be with all that crying if i get her or you fuck with motions i'm gon' light ya girl on fire pussy was good pussy was perfect but if i ever pop up on you fuckin' that bitch boy you gon' need a surgeon  hook leave that bitch alone leave that bitch alone you knew that i was crazy why the fuck you took her home now i'm goin' through your phone seein' all these hoes you knew that i don't like her what type of crazy shit you on   leave that bitch alone
37,Cardi B,Trick,"Gangsta Bitch Music, Vol. 1",2016,2016-03-07,boy you a trick trick trick trick trick trick you ain't nothing but a trick trick trick trick trick you catching feelings like a ho you's a trick trick trick trick trick no love no love for a trick trick trick trick trick no love no love for a   rule number one if you ain't paying that's a no rule number two tricks wait at the door rule number three don't you tell me about your kids cause i don't give a fuck nigga i'll tell you how it is rule number four you ain't never fucking raw no matter how much money is involved fuck you thought rule number five i need unlimited supply whatever i want you buy rule number six when we in the club don't be taking all the pics pay for the licks you ain't getting no kiss nigga i ain't your bitch nigga you ain't shit nigga no hugs no love you's a   boy you a trick trick trick trick trick trick you ain't nothing but a trick trick trick trick trick you catching feelings like a ho you's a trick trick trick trick trick no love no love for a trick trick trick trick trick no love no love for a   rule number seven when you take me out to eat after that day you can't see me for the week rule number eight you can't call me babe boy we don't relate let's get that shit straight rule number nine i ain't tryna wine and dine i'm just tryna shop bust a nut then goodbye rule number ten when that bank account ends i find a new trick let the new games begin i'm such a ho ass bitch big thot big thot you thought i like you for you noooo you think we have something in common   boy you a trick trick trick trick trick trick you ain't nothing but a trick trick trick trick trick you catching feelings like a ho you's a trick trick trick trick trick no love no love for a trick trick trick trick trick no love no love for a
38,Cardi B,B.O.N,"Gangsta Bitch Music, Vol. 1 (Promo CD)",2016,2016-03-07,fuck all that talking shit fuck all that stalling shit i came here to eat i ain't with that starving shit been on the hustle since young so i been involved in shit the fakes the snakes heartbreaks i mean all of it i'm in my zone now and i ain't gon fold up they like cardi all grown up yea bitch i glo'ed up they ain't see the blizzard coming these niggas done froze up they mad they been sleeping on me just be like you woke up i don't make scenes i just make movies clip after clip after clip call it a uzi i feel like a bad ass i feel like i'm boosie they quick to judge a bitch just wish they knew me i know a couple hittas done pulled a couple triggers violate me they gon come and get you and i'm tired of y'all baby mamas y'all nothing but drama always worrying about the new bitch why you so foolish watching my moves you like how i do shit i make you feel insecure but that's not my problem just worry about your kid and i'ma keep popping my collar and for those who want to know i'm not your average hoe i be on my bullshit but yea i got standards though yeah i fucked a couple niggas pulled a couple tricks bust a couple splits sucked a couple dicks but there is a story to everything and that's just real shit my family had to eat and i had to pay the rent if it's green i'ma get it please stay the fuck out my business bitch try me i promise you get it bitch try me there will be no winning gotta watch all these faces there's too many counterfeits sometimes when you hear them say i got you you can't even count on it that's why i fuck with my bitches only my bitches my day one bitches so please do not fuck with my bitches that's a brick in your face and you gon need stitches i see that you moving suspicious 00 dollars they do you with quickness that's word to my niece i'm not kidding i fuck with them bons and they get vicious
39,Cardi B,What A Girl Likes,,2016,2016-06-10,hook gimme shmoney gimme gimme shmoney gimme shmoney gimme gimme shmoney yeah it's what a girl like yeah it's what a girl like i don't want ya man i just want this shmoney i don't want ya man i just want this shmoney that's what a girl like that's what a girl like   gimme money all i want is money i'm cardi b all i know is shmoney shmoney beat ya bitch if it's not green then back up off me fuck it send em' ebts food stamps this shit not funny i'm here for money and i'm bout to put in work yellow man nobody move nobody get hurt it's just to the paper fuck it man i got a cake up niggas spend all this money you saved up throw it all in his face like it's makeup yeah nigga straight up  hook gimme shmoney gimme gimme shmoney gimme shmoney gimme gimme shmoney yeah it's what a girl like yeah it's what a girl like i don't want ya man i just want this shmoney i don't want ya man i just want this shmoney that's what a girl like that's what a girl like   i don't want ya man hoe i just want the money why don't you understand hoe please don't be a dummy his name not benjamin he can't do nothing for me it's all about a check and plus that nigga ugly he like my setup how i dress up so i gas his head up he spend that cheddar mozzarella yeah he fuck that check up i tell him step up put that bread up don't you hesitate i have the goons at your door like hello what's in the safe  hook gimme shmoney gimme gimme shmoney gimme shmoney gimme gimme shmoney yeah it's what a girl like yeah it's what a girl like i don't want ya man i just want this shmoney i don't want ya man i just want this shmoney that's what a girl like that's what a girl like
40,Cardi B,Styling*,CB2,nan,nan,lyrics from snippet   stylin' on these hoes i'm stylin' on these hoes i be stylin' on these hoes i'm stylin' on these hoes  wrist full of gold i be stylin' on these niggas stylin' on these hoes grind up a check got it at the store runnin' through the checks till the club close stylin' on these niggas stylin' on these hoes i be stylin' on these bitches stylin' on these hoes   i gotta get it i need the chicken i need the bread that's why i'm workin' and i'm in the benz 'cause you in the bed bitches is sleepin' fuck is they thinkin' what is you doin' then they be mad lookin' at me like i did something to 'em uh bank account on racks pussy still on drip drop put this pussy on wax took me straight to the tip top i might race with the wraith ain't no space in the safe next bitch in my face catchin' case catchin' case but anywho anywho birkin bag jimmy choos all my bitches say eeeeooowwww all my guns go boom more guns than the warden smack hoes with my jordans pussy's floodin' new orleans kiss a bitch and i'm gorgeous never been no pussy yo i'm always with the shits i ain't never been no dirty broad but now i'm filthy rich bitch bitch   stylin' on these hoes i'm stylin' on these hoes i be stylin' on these hoes i'm stylin' on these hoes  wrist full of gold i be stylin' on these niggas stylin' on these hoes grind up a check got it at the store runnin' through the checks till the club close stylin' on these niggas stylin' on these hoes i be stylin' on these bitches stylin' on these hoes   money money money money's all i think of i swear to god i wake up and get the green stuff you put your money on these hoes get your refund i just got my nails did i just got my weave done if you want a fly press put bardi on that shit i just bought a new gun put a body on that shit she upstairs i'ma wait in the lobby for that bitch i got my bitch and a man that can buy me all that shit you can find my fine ass bathtub with a wine glass all these hoes wanna bring me down i don't never ever mind that can you show me where your money is 'cause i know where mine's at all the energy you put in me you just tryna get the top back lately i been on some conceited shit 'cause i don't need a bitch blast off i don't feed a bitch that's how i treat a bitch in my hood i got hella stripes straight adidas shit hope she got the same energy when i see that bitch bitch   stylin' on these hoes i'm stylin' on these hoes i be stylin' on these hoes i'm stylin' on these hoes  wrist full of gold i be stylin' on these niggas stylin' on these hoes grind up a check got it at the store runnin' through the checks till the club close stylin' on these niggas stylin' on these hoes i be stylin' on these bitches stylin' on these hoes
41,Cardi B,I Like It (Kontra K & AK Ausserkontrolle Remix),,2018,2018-08-17,yeah baby i like it like that you gotta believe me when i tell you i said i like it like that you gotta believe me when i tell you i said i like it like   cardi b now i like dollars i like diamonds i like stuntin' i like shinin' i like million dollar deals where's my pen bitch i'm signin' signin' i like those balenciagas those the ones that look like socks i like going to the jeweler i put rocks all in my watch chaching i like texts from my exes when they want a second chance what i like proving niggas wrong i do what they say i can't she can't they call me cardi bardi banging body spicy mami hot tamale hotter than a somali fur coat ferrari rrr woo hop out the stu' jump in the coupe coupe big dipper on top of the roof flexing on bitches as hard as i can eating halal driving the lam' told that bitch i'm sorry though sorry 'bout my coins like mario mario yeah they call me cardi b i run this shit like cardio woo facts   cardi b diamond district in the jag i said i like it like that certified you know i'm gang gang gang gang i said i like it like drop the top and blow the brains woo i said i like it like that oh he's so handsome what's his name yeah i said i like it oh i need the dollars chaching i said i like it like that beat it up like piñatas i said i like it like tell the driver close the curtains i said i like it like that skrrt bad bitch make you nervous i said i like it   kontra k ich mag die liebe mag die stille mag den hustle den wir leben leben hass' die falschheit vieler blender aber lieb' ganovenehre wooh ich mag leute die nicht quatschen sondern lieber stille wasser und statt gold sammeln wie inkas lieber 'ne finca für meinen vater ahh meine gang regiert den plaza alle meine jungs sind on fuego was für hahn im korb ich seh' maximal nur calimeros gangster schweigen und genießen also quatsch mir nicht pendejo denn ein rückgrat ist mehr wert als die taschen voll dinero geld kommt geld geht aber familie bleibt der innere kreis elitär und klein auch wenn der teufel viele gesichter zeigt gott sei dank nicht meins meins jeder testet jeder redet jeder schneidet sich ins fleisch ich halt' meine leute halt' meine ziele meine versprechen immer ein ein courage über fame fame und lieber wölfe die noch beißen als die köter die nur bell'n klasse über geld und lieber loyalität für meine gang als den erfolg nur für mich selbst selbst selbst   cardi b diamond district in the jag i said i like it like that certified you know i'm gang gang gang gang i said i like it like drop the top and blow the brains woo i said i like it like that oh he's so handsome what's his name yeah i said i like it oh i need the dollars chaching i said i like it like that beat it up like piñatas i said i like it like tell the driver close the curtains i said i like it like that skrrt bad bitch make you nervous i said i like it   ak ausserkontrolle früher ist papa zur arbeit mit tickets gefahr'n heute sitzt papa im dickesten wagen weil wir bizzy war'n weil wir weil wir bizzy war'n meine devise ist klar einhundert riesen in bar ak syndicat ak aksyndicat egal ob benza oder siebener wir fahr'n vor das ist gangster unser leben einfach hardcore tatort fliehen vom tatort tatort fliehen vom tatort mach' kilo für kilo weg salame salame sie machen minus jetzt jealousi jealousi wir sind jungs die immer mehr woll'n rolex am gelenk unsere zeit ist wertvoll keine hunderttausendeuroschecks nein nein ich will alles bar bar bar meine jungs und ich verkaufen flex steig ein doch ich will alles bar bar bar   cardi b diamond district in the jag i said i like it like that certified you know i'm gang i said i like it like drop the top and blow the brains woo i said i like it like that oh he's so handsome what's his name yeah i said i like it
42,Cardi B,I Gotta Hurt You,"Gangsta Bitch Music, Vol. 1 (Promo CD)",2016,2016-03-07,you know i could love you with all my heart you're my baby and and i love you i just i just feel the need to hurt you maybe i'm scorn maybe i need a therapist maybe i'm petty i just   i want to hurt you i want to hurt you i want to hurt you i need to make you sure you remember me forever eeeeever eeeeever eeeeever i was raised well eeeeever eeeeever eeeeever i want to hurt you i want to hurt you i want to i want to hurt you i want to hurt hurt hurt i want to hurt you forever i want to hurt you i want to i want to hurt you forever i want to hurt hurt hurt hurt i want to hurt you   i want to hurt you i got to make sure that you feel me i need to make sure you remember me forever i have to show you   hi there my name is my name is cardi cardi cardi cardi i don't know i love it i love it lonelyness it fulfills my sorrow you may think you may think i have no tomorrow its easier to die than to live but i will show you that i'm strong enough to use you and abuse you and i'm gonna live and i'm gonna win haha i'm gonna win i'm gonna win i'm gonna win i'm gonna win i'm gonna win iiiii'm goonna win   i want to hurt you i got to make sure that you feel me i need to make sure they remember me forever i have to show you
43,Cardi B,Pop Off,"Gangsta Bitch Music, Vol. 2",2017,2017-01-20,cardi b them motherfuckers be like but what type of niggas will wife you my type of niggas will wife me the type of niggas that like bitches that pop off and suck dick all day motherfuckin' long bitch thanks to all my followers that always defended me y'all like my god brothers and god sisters i would dead jump in your fight i would dead jump in your fight now what's poppin  hook cardi b who wanna pop off who wanna start war they talkin' shit i'm takin' tops off jeans off weaves off rings off everythin' off who wanna pop off who wanna start war they talkin' shit i'm takin' tops off jeans off weaves off rings off everythin' off   cardi b i'm startin' to lose my patience weak bitches hatin' bitches throwing subs like i won't kick your face in baby mama's mad 'cause i'm in first place and when it comes to you bitch there's no conversation i been to give it up grimy i'm the bronx bitch i'm feisty cardi why you feisty shut up bitch fight me ny raised and so you know it's very likely that when i hear some shit that i don't like i get hype b who would wanna wife me your nigga wanna wife me you think 'cause i'm a stripper hoe that nigga won't think twice b put this pussy on his face rde that shit nicely set his ass up then you really ain't gon' like me so what you tryna do you and you and you i feel some type a way a bitch finna get loose tell me what's the deal i'm 'bout to start the hill the wig is comin' off shit 'bout to get real  hook cardi b who wanna pop off who wanna start war they talkin' shit i'm takin' tops off jeans off weaves off rings off everythin' off who wanna pop off who wanna start war they talkin' shit i'm takin' tops off jeans off weaves off rings off everythin' off   casanova got beef with cardi b i'm poppin' off shit get hectic i'ma drop it off oh you shinin' your chain and your watch is off you was never with this shit nigga knock it off youse a pussy and your whole block is soft you caught feelings could she ain't even drop you off you thought that bag was gettin' you pussy not at all you was gettin' lied you ain't know she made that call to the dog's dinner and they starvin' i gotta feed all 'em i'maget that nigga you gon' get that bitch what they thought switched 'cause we both got rich nah we on the same time you got yours i got mine you got a problem get in line it's cardi b and  times  hook cardi b who wanna pop off who wanna start war they talkin' shit i'm takin' tops off jeans off weaves off rings off everythin' off who wanna pop off who wanna start war they talkin' shit i'm takin' tops off jeans off weaves off rings off everythin' off   cardi b shit that bitch six three and she bodied superman calves and her shoulder somethin' retarded i ain't backin' down cardi got the heart regardless you gon' have to knock me out if you think i'ma forfeit gang gang squad up and have my niggas all on it pay a couple niggas and they had you out in a coffin and i put that on my life i really don't do this often but the way i'm feelin' now like whatever i'm on it have you laid out on the stretcher with your socks off had the pastor prayin' like sorry for your loss throw dirt on my name you better pop off my name ring bells like mayweather box off i'm cardi b east coast newest contender 5' lookin' good with the nails bananas freddy kruger on these bitches i cut their lights off should have read the memo cardi b pops off
44,Cardi B,How I Do,"Gangsta Bitch Music, Vol. 2",2017,2017-01-20,gangsta  cardi  b    this is how i do i make a fool out these bitches they be thinking they tough this is how i do i make these niggas spend their money then i show them no love this is how i do if the bag not involved then you know it's a dub this is how i do they ain't fuck with me before now i gotta stunt   pull up like huh they looking like what heads turn left and right they wonder who's her cardi b duh bitch don't front you on my gram all day don't play dumb came up from the slums the dirty dirty bronx where niggas quick to clip your shit no fair ones you gotta keep a gun but beef to me is fun i never back down been this way since day one  pre they shit on me before thought i was just a stupid hoe they tight now they realize they was sleeping on gold took me one year man and now i'm doin' shows now they wanna take pics with me hold on let me pose believe me i easily can do a bitch greasy i'll give it to you just how you like it girlll cardi b in full effect couple bitches upset couple niggas wanna hit it and they can't so they stressed   this is how i do i make a fool out these bitches they be thinking they tough this is how i do i make these niggas spend their money then i show them no love this is how i do if the bag not involved then you know it's a dub this is how i do they ain't fuck with me before now i gotta stunt   cardi in tune bitches make room test me the gat goes click clack boom gangsta bitch oooh volume  cop somethin' mean when it start you hear that vroom pull up to your side 0 deep right stuntin' on my ex he thirsty for a reply sick sick sick call my phone it's click had me fucked up when you was fucking with that bitch  pre making power moves goin' 50 on 'em same ones that played me highsiddity on 'em back to back with it goin' drizzy on 'em now they tight they gotta watch me make a milli on 'em   haha  yo yo remember remember nigga when you told me that i was gonna work in that strip club divas on 77th in the bronx for the rest of my life well guess what nigga now i'm the fucking diva shit fuck outta here gangsta
45,Cardi B,Booty*,CB2,nan,nan,lyrics from snippet   bardi bardi bardi  verse booty so stupid it's a motherfucking retard i'm from the bronx but my booty from the dr booty so big i don't need to have titties titties booty prolly get a job at magic city magic city booty so poppin' have your girl doin' research i'm the white stain on the bottom of his tshirt booty so big have you calling outta work nigga drop it down fuck around i might hurt niggas booty so big that it swallow up panties same with these hoes swallow up the xanny i'm cardi b i go rah with my jammies booty on the track fuck around and win a grammy they call me cardi code red lightskinned bone legged tell him throw more bread i put it on his forehead i remember when i used to pay bills with it now i just  booty so big have to question a nigga dick game booty so big that it got its own nickname booty so big that it got its own zip code booty so big
