,Artist,Title,Album,Year,Date,Lyric
14,Cardi B,Money Bag,Invasion of Privacy,2018,2018-04-06,money bag money bag money bag bitch i'm lookin' like a money bag yeah money bag cardi   i do the maybach on monday ferrari friday this is sweet pussy saturday that's just what plies say i said bae it's a snack he said it's an entrée with them pretty ass twins you look like beyoncé lookin' like money bag money bag money bag uh money bag money bag money bag yeah money bag money bag money bag uh money bag money bag money bag he can tell from the front i got ass behind me and i park my bentley truck on my versace driveway skrrt lookin' like money bag money bag money bag uh money bag money bag money bag yeah money bag money bag money bag woo money bag money bag money bag and my bitches with me pretty too they look like bridesmaids and they all bloody gang so don't be talkin' sideways   he said i'm protein thick you look like a dope fiend sis he make sure he put cardi down on his grocery list now why this bitch tryna look on my snap i take your man and i won't give him back i just walk into the booth and attack i hit this grind the roof gon' collapse i been broke my whole life i have no clue what to do with these racks wig be laid waist snatched ass fat straight facts got lips like angelina bentley truck tangerine unh tramps jumpin' on my dick that's why they call it trampoline uh   i do the maybach on monday ferrari friday this is sweet pussy saturday that's just what plies say i said bae it's a snack he said it's a entrée with them pretty ass twins you look like beyoncé lookin' like money bag money bag money bag uh money bag money bag money bag yeah money bag money bag money bag uh money bag money bag money bag he can tell from the front i got ass behind me and i park my bentley truck on my versace driveway lookin' like money bag money bag money bag uh money bag money bag money bag yeah money bag money bag money bag woo money bag money bag money bag and my bitches with me pretty too they look like bridesmaids and they all bloody gang so don't be talkin' sideways   these bitches salty they sodium they jelly petroleum always talkin' in the background don't never come to the podium chef cardi b i'm cookin' up i see you hoes at the stove again while you hoes were sleepin' on me i made 40 bands by 4pm they be taking shots miss miss x and o kiss kiss everythin' your nigga want i'm like a walkin' wishlist i don't understand what this hate is about how you gon' suck yo' man dick with my name in yo' mouth   i do the maybach on monday ferrari friday this is sweet pussy saturday that's just what plies say i said bae it's a snack he said it's a entrée with them pretty ass twins you look like beyoncé lookin' like money bag money bag money bag uh money bag money bag money bag yeah money bag money bag money bag uh money bag money bag money bag he can tell from the front i got ass behind me and i park my bentley truck on my versace driveway lookin' like money bag money bag money bag uh money bag money bag money bag yeah money bag money bag money bag woo money bag money bag money bag and my bitches with me pretty too they look like bridesmaids and they all bloody gang so don't be talkin' sideways
15,Cardi B,Red Barz,,2017,2017-04-05,uh yeah some regular degular bloody bars  verse i swear to god they ain't wanna see me leave the club got up on my shit and now they scared to show me love they'd rather see me on the pole twerkin' it for dubs i guess i really gotta show them what the fuck is up i'm on some other shit that cardi b gutta shit every time i catch a hating bitch she on her stutter shit can't finish her words but on instagram thuggin' shit you set yourself up don't make it seem like i be buggin' bitch and niggas hatin' on me really be upset i don't know make me wonder what you got between your legs you a real nigga mad at a bitch for getting bread you's a bitch from birth you just grew a third leg woo bite down bite down it was crunch time yeah i skip all of them bitches in the lunch line i put in work now i'm here at the front line ready for the bullshit i swear it's on my bloodline touch mine getting slumped slimed one time pump blind bitches quick then i dump mine pull up with the gucci clutch spitting clutch rhymes flyer than a big big b with a blood tie don't do much he get hard when i bust wines no straws for this juice box gulp one time last nigga i was with went insane 'cause my head game over hills like i'm lookin' for the sunshine i'm a bronx bitch birthed from the hiphop from the block to the tick tock in the patek watch quick drop with the cash couldn't fit the ziploc grips locked get your shit popped in my flip flops wealthy now but every dollar i still want it all now he wanna nail me i could give your man a cure you gotta mail me but i don't check my spam at all never feel what you're sayin' like i'm usin' anbesol travel all around the states getting nice checks i was tourin' off a tape i had a hype set is that the reason all these niggas wanna pipe next i'm a creep bitch see his dick through his nike tech got 'em all scared i ain't even strike yet wire up jaws when i swing if the mic stretch i worked hard took the right steps had a shot so i took the shit now this game gon' need a life vest   uh i said woo huh
16,Cardi B,Foreva,"Gangsta Bitch Music, Vol. 1 (Promo CD)",2016,2016-03-07,producer tag swiftondemand   ran down on that bitch twice ran down on that bitch twice you know me i be with whatever if a bitch beef with me we gon' beef foreva ran down on that bitch twice ran down on that bitch twice you know me i be with whatever if a bitch beef with me we gon' beef foreva   why you always tryna run and hide always have my name up in your mouth you outta line you gon' make me pop up at your door like surprise like come outside lil' bitch come outside never by my lonely got my niggas by my side and all my niggas skrr skrr yeah they down to ride yeah my bitches go to work i'm talking 9 to 5 the streets want to fuck around you won't stay alive your man can cross you and i make sure that you pay the price so don't be lacking when you coming home from work at night you run your mouth i poppin out now it's on sight you gon' be just like my pussy hella tight a hoe can hate but don't be fucking with my commas and if she is i'll shape her up and she gon' get the line up can't be starting all these problems if you cannot solve em cardi backing down i swear to god that's not an option   ran down on that bitch twice ran down on that bitch twice you know me i be with whatever if a bitch beef with me we gon' beef foreva ran down on that bitch twice ran down on that bitch twice you know me i be with whatever if a bitch beef with me we gon' beef foreva   some bitches claim they with the shits but they ain't with a thing i spin the block come around like a boomerang silence silence i don't hear a thing worry about me but your pussy smell like turtle tank i pull up on that check nothing less that's all i do 0 bands 50 bands ain't nothing new i see some people who still worried about my revenue i'm eating good you wish you could don't worry about my food and niggas hating on a female ain't no way to live you bitch made make me wonder if you got a dick how you feeling like a man envying a chick wake up and go get some money go and find your niche silly muthafucka who raised you a nigga with a pussy how disgraceful i have my hittas come and duck tape you and your bitch could get it too double date boo so let's get it so let's get it so let's get it let's not waste a minute you clearly started so let's finish i don't do forgiveness they take your kindness for a gimmick i'm just here for business i'm running down and i'm with it   ran down on that bitch twice ran down on that bitch twice you know me i be with whatever if a bitch beef with me we gon' beef foreva ran down on that bitch twice ran down on that bitch twice you know me i be with whatever if a bitch beef with me we gon' beef foreva
17,Cardi B,Lick,"Gangsta Bitch Music, Vol. 2",2017,2017-01-20,yeah lookin' like i caught a look at me cardi look at me cardi look at me woah   lookin' like i caught a lick run up on me you get hit and all my bitches with the shits bronx new york gangsta bitch lookin' like i caught a lick since day  i've been that bitch got some hittas in my clique lookin' like i caught a lick lookin' like i caught a lick   look at me look at me they ain't like me before now they bookin' me the glow got bitches so shook at me they like chef cardi b what you cookin' b i say bitches got me on some new shit i swear niggas got me feelin' ruthless too much mo'fuckers done doubted me that's why i had to just prove it i remember walkin' in the stores i couldn't buy nothin' they look at me starin' now i just walk in the stores i like it i cop it i don't even think bank tellers asking for info 'cause now my deposits on kimbo told that bitch gimme my money why the fuck you askin' all this info  pre run up get done up got shooters ready for a come up promise you i didn't luck up was grindin' all night didn't sleep 'til the sun up now i got up on my shit walk around like i'm that bitch every nigga wanna hit   lookin' like i caught a lick run up on me you get hit and all my bitches with the shits bronx new york gangsta bitch lookin' like i caught a lick since day  i've been that bitch got some hittas in my clique lookin' like i caught a lick lookin' like i caught a lick   see me in my 'bach now they all surprised now they call my phone i just press decline not even six seconds i don't give 'em vine tell 'em fall back all must recline bitches mad as fuck but i don't give a fuck niggas can't believe it better soak it up lookin' like i caught a lick bitch your nigga got me on his wishlist thought i was makin' no moves thought i was gon' be livin' in sues thought i was makin' no money you fuckin' thought i was gon' lose everythin' i did i swear i got paid been 'bout my money that ain't gon' change bitch you gon' drown tryna ride on my wave corny ass bitches i just can't relate  pre run up get done up got shooters ready for a come up promise you i didn't luck up was grindin' all night didn't sleep 'til the sun up now i got up on my shit walk around like i'm that bitch every nigga wanna hit   lookin' like i caught a lick run up on me you get hit and all my bitches with the shits bronx new york gangsta bitch lookin' like i caught a lick since day  i've been that bitch got some hittas in my clique lookin' like i caught a lick lookin' like i caught a lick   look at me look at me look at me look at me
18,Cardi B,Bodak Yellow (Latin Trap Remix),,2017,2017-08-18,letra de bodak yellow latin trap remix ft messiah el artista   cardi b ksr ooh hah it's cardi ayy said i'm the shit they can't fuck with me if they wanted to umm  coro cardi b said lil bitch you can't fuck with me ni aunque tú quieras that's a fact cardi b y de el trap soy la mamá hit the store y compro todo lo que quiera comprar chin i'm a boss you a worker yo a'lante y tú atrás weeooh esta canción es pa' mis goonies y mis cuero' wuh wuh un show mío lo que tú haces en un año entero si me ves no me saludes tú y yo no somos amiga' ajá si tú no hace' dinero tú no eres de las mías  verso  cardi b di'que que tú puedes contra mi vamo' a averiguar vamo' allá soy rapera y también yo sé pelear you in the club tú chapeando yo llegando y cobrando siempre estoy depositando 'tán cansao' de mí en el banco wuh en verdad no me importa a quien yo le caiga mal llevo dos mixtapes en seis meses nadie me puede parar i don't bother with these hoes don't let these hoes bother me all these bitches son mis hijas to'as se copian de mí mira yo me robo a tu novio ooh hago coro con tu esposo tu jevo 'tá aficia'o sé que lo tengo sabroso yo se lo pongo en el poso i'm like okay okay yo le pido lo que quiera él me compra mi cartera y una jeepeta lo tengo tan aficia'o que hasta me paga mi renta soy la más dura en la calle know you prolly heard of me me busca me arreglé los dientes hope you hoes know it ain't cheap pago la renta de mi madre y no dependo de nadie si no hablas de dinero es mejor que ni me hables  coro cardi b said lil bitch you can't fuck with me ni aunque tú quieras that's a fact cardi b y de el trap soy la mamá hit the store y compro todo lo que quiera comprar i'm a boss you a worker yo a'lante y tú atrás esta canción es pa' mis goonies y mis cuero' wuh wuh un show mío lo que tú haces en un año entero si me ves no me saludes tú y yo no somos amiga' ajá si tú no hace' dinero tú no eres de las mías  verso  messiah el artista dique que tú puedes contra mi suelta eso bi nigga please to mis show son pago ninguno gratis créeme a mí no hagas que yo coja aquí un felony i'm the big beef for well these niggas know my pedigree honestly i got bad bitches that wanna fuck with me suck on me ride me crazy y dejarme seco a mí que yo no 'taba sonando que no 'taba haciendo bulla dique que estaba apagao y pegao con la jeva tuya ando con mi primo lucas un corito sano y con par de putas lo que tu gasta' una noche en botellas eso yo lo gasto en refilles de hookah los cueros dicen messiah 'ta de pinga porque nos da y después se embala a lo mejor ella pensaba que yo iba a darle y después mudarla andamo' en la calle o sea en la lleca skrt andamo' fumando peyote purple haze en mi yerba hablan mierda a tu espalda y cuando te ven ellos no dicen na' ando con mi hermano dj hova and tonight we gonna shake the block  coro cardi b said lil bitch you can't fuck with me ni aunque tú quieras that's a fact cardi b y de el trap soy la mamá hit the store y compro todo lo que quiera comprar i'm a boss you a worker yo alante y tú atrás esta canción es pa' mis goonies y mis cueros un show mío lo que tú haces en un año entero si me ves no me saludes tú y yo no somos amiga' si tú no hace' dinero tú no eres de las mías
19,Cardi B,Up,CB2,2021,2021-02-05,up up up ayy up uh up look this is fire   once upon a time man i heard that i was ugly came from a bitch who nigga wanna fuck on me i said my face bomb ass tight racks stack up shaq height jewelry on me flashlight i been lit since last night hit him with that good good make a nigga act right broke boys don't deserve no pussy i know that's right  pre big bag bussin' out the bentley bentayga man balenciaga bardi back and all these bitches fucked it's big bags bussin' out the bentley bentayga man birkin bag bardi back and all you bitches fucked   if it's up then it's up then it's up then it's stuck if it's up then it's up then it's up then it's stuck huh ayy up then it's up if it's up then it's stuck huh if it's up then it's up then it's up then it's stuck huh woo   i could make the party hot i could make your body rock bitches say they fuckin' with me chances are they probably not if i had a dick you'd probably lick it like a lollipop hoes speakin' capenese hit 'em with karate chop i'm forever poppin' shit pullin' up and droppin' shit gotta argue with him 'cause a nigga love a toxic bitch niggas out here playin' gotta make 'em understand if ain't no ring on my finger you ain't goin' on my 'gram i said my face bomb ass tight racks stack up shaq height yeah jewelry on me flashlight huh i been lit since last night woo hit him with that good good make a nigga act right ah broke boys don't deserve no pussy i know that's right  pre big bag bussin' out the bentley bentayga man balenciaga bardi back and all these bitches fucked woo it's big bags bussin' out the bentley bentayga man birkin bag bardi back and all you bitches fucked   if it's up then it's up then it's up then it's stuck if it's up then it's up then it's up then it's stuck huh ayy up then it's up if it's up then it's stuck if it's up then it's up then it's up then it's stuck huh ayy   bitches ain't fuckin' with me now and i can see why dirtyass dustyass bitch you got pink eye bitches want smoke until i bring it to they doorstep tell that bitch back back breath smell like horse sex ha put it on him now he will never be the same he won't tatted on my ass 'cause i really like the pain ah he nutted on my butt i said i'm glad that you came if that nigga had a twin i would let 'em run a train skrrt  pre big bag bussin' out the bentley bentayga man balenciaga bardi back and all these bitches fucked woo it's big bags bussin' out the bentley bentayga man birkin bag bardi back and all you bitches fucked ooh   if it's up then it's up then it's up then it's stuck if it's up then it's up then it's up then it's stuck huh woo up then it's up if it's up then it's stuck woo if it's up then it's up then it's up then it's stuck huh   look gotta play it safe huh no face no case hahaha
20,Cardi B,Washpoppin,"Gangsta Bitch Music, Vol. 1 (Promo CD)",2016,2016-03-07,i need all my money makers bring that cash out i need all my d boys to bring that cash out i need all my scammer niggas bring that cash out don't you see these big ass titties and this ass out i need all my money makers bring that cash out i need all my d boys to bring that cash out i need all my scammer niggas bring that cash out don't you see these big ass titties and this ass out   lil' trick go bust a band on a bitch now give me all that money you be spending on your chick now give me all that money you be spending on your kid now give me all that money you been stacking for your rent nigga i'm just into making money i ain't into making love when you hear that stripper hoe i'm the one you thinking of i'm the bitch they love to hate i'm the bitch they hate and love yellow bitch i look like diamond in playas club you want to be my main squeeze baby don't you you want to give a bitch a seed baby don't you you hit the club with 0 gs baby don't you and spend that all on cardi b baby don't you i need like 0k right now i need like 0k right now i need like 50k right now all you broke niggas get out the way right now   i need all my money makers bring that cash out i need all my d boys to bring that cash out i need all my scammer niggas bring that cash out don't you see these big ass titties and this ass out i need all my money makers bring that cash out i need all my d boys to bring that cash out i need all my scammer niggas bring that cash out don't you see these big ass titties and this ass out   real niggas fuck with me the bad bitches fuck with me so if you don't it's probably cause you broke or you ugly real niggas fuck with me the bad bitches fuck with me so if you don't it's probably cause you broke or you ugly every time that i'm on the roadpopping every time that i do a showpopping when i put this pussy on the polepopping friends want to have these cornrowspopping   i need all my money makers bring that cash out i need all my d boys to bring that cash out i need all my scammer niggas bring that cash out don't you see these big ass titties and this ass out i need all my money makers bring that cash out i need all my d boys to bring that cash out i need all my scammer niggas bring that cash out don't you see these big ass titties and this ass out   you bitches be so fucking thick but it's cool 'cause i'll be fake too now people be like you stupid bitch strippening over a real job so how the fuck about we've been
21,Cardi B,On Fleek,"Gangsta Bitch Music, Vol. 1 (Promo CD)",2016,2016-03-07,i pull up like what's up everything on fleek i do it nice seven days a week like oh my oh my oh my god i don't do nothing for free you know i got to charge when i'm done they be like you better you better you better you better when that check come i be like you better you better you better   i'm cardi exotic my ice retarded i walk in the party get started murder scene he want all this your bitch i demolish on fleek is what you call it this not a game fuck is you saying bullshit is something i don't entertain come correct if gon' call out my name not talking money i'm switching these lanes like swerve now watch me now watch me swag surf boy you better respect the curve i'm on my bullshit fuck what you heard oh you ain't know well you gon' learn   i pull up like what's up everything on fleek i do it nice seven days a week like oh my oh my oh my god i don't do nothing for free you know i got to charge when i'm done they be like you better you better you better you better when that check come i be like you better you better you better   fleek the definition of me i keep it in check papi i am a whole different breed i'm cardi capiche them other ones can't compete i make bitches want to retreat i go to the desert for weeks when i come back i come back with heat now they be all up in my dm tryna get cardi b to pm i swear to god i don't see 'em i'm high up in the hills like the weeknd   i pull up like what's up everything on fleek i do it nice seven days a week like oh my oh my oh my god i don't do nothing for free you know i got to charge when i'm done they be like you better do better you better you better when that check come i be like you better you better you better
22,Cardi B,Selfish,"Gangsta Bitch Music, Vol. 1 (Promo CD)",2016,2016-03-07,cardi b i gave you more than i give myself so loyal to you that i betray myself well i guess ima wither away  you a snake and you chose to slither today i gave my all my love and my trust but i guess my all just wasn't enough yeah there's something about you i can't help it but ima do for myself i'm being selfish   josh x babe your melody is the voice i need makes me skip a beat yeah and baby you know it yeah but it's hard to show it see the one i love used to be in clubs used to fuck with thugs yeah and i can't expose it yeah cause she already know it yeah but why don't you ask me why is it so hard to fall in love why don't you ask me why can i never ever ever try why don't you ask me why everything is going this way why don't you ask me i guess we don't know they say the one that you truly love hurts you the most now the one that i truly love hurt me the most now the one that you truly love is hurting you the most i guess i'll never know why i got so cold it's not your fault   cardi b  josh x be selfish be selfish be selfish withering away as i gaze at the sky looking at his face and all the pain it's caused me i ask why didn't i love didn't i give you more than i ever gave myself what do you wish cause that part of me no longer exist this time i'm first i'm picking me i finally learned to be selfish
23,Cardi B,Pull Up,"Gangsta Bitch Music, Vol. 2",2017,2017-01-20,swiftondemand   hella fake you better pull up on me i hope you feel the same when you see my face you better pull up on me ain't no backin' down prepared to shake you better pull up on me now you wanna be my friend no you ain't safe you better pull up homie pull up pull up pull up pull up on me pull up pull up pull up pull up on me i heard you talkin' cray i know you hella fake you better pull up on me i hope you feel the same when you see my face   no i don't think they know they don't know how this go they think i'm broke what a fuckin' joke when i walk in the door i gets my dough then a bitch get low i used to kill them poles now i kill them shows they don't like my growth well fuck ya hoes yeah 'cause all my bitches that be gettin' with me if i put a fifty they gon' put a fifty every night ask sue's rendezvous it was kita sweetness and ashanti with me i had to go get it on some real shit if you a real bitch you gon' feel this every single nigga that came my way i finesse and juug on some ill shit so much people think they know my pussy but no one can say they fucked please show me hoe facts namedrop round 'em up that bum bitch like to run her mouth i swear to god i'ma lay her out when i catch you on the side of town my guiseppe heels gonna stomp you out i'm tired of playin' i'm tired of playin' i'ma give you hell you gon' think i'm satan i see you mad 'cause i'm 'bout to have this whole shit on lock incarceration someone gave you wrong information you try to play me that's confirmation but it's all good 'cause when you see my face shit don't come out like it's constipation  pre you stuck bitch yeah i know it sucks bitch yeah pull up bitch yeah like wassup bitch yeah   pull up on me i heard you talkin' cray i know you hella fake you better pull up on me i hope you feel the same when you see my face you better pull up on me ain't no backin' down prepared to shake you better pull up on me now you wanna be my friend no you ain't safe you better pull up homie   let's go i mean come on now who you tryna flex for why you actin' like i won't leave you down in the ground but you knew what it was from the getgo that cardi on some new shit get that money then i go flip some people think i'm just a dumb bitch if that was true i wouldn't have shit yeah bronx bitch 'til the day i die i did my dirt and i ain't gotta lie you can talk crazy on ig but when i run up let them hands fly i don't fuck around with no fuckin' clowns any niggas with me they fuckin' hounds any bitches with me they fuckin' down so if you really 'bout it then pull up now  pre you stuck bitch yeah i know it sucks bitch yeah pull up bitch yeah like wassup bitch yeah   pull up on me i heard you talkin' cray i know you hella fake you better pull up on me i hope you feel the same when you see my face you better pull up on me ain't no backin' down prepared to shake you better pull up on me now you wanna be my friend no you ain't safe you better pull up homie
