,Artist,Title,Album,Year,Date,Lyric
102,Taylor Swift,How You Get the Girl,1989,2014,2014-10-27,oh oh oh oh oh oh ohoh ohoh   stand there like a ghost shaking from the rain rain she'll open up the door and say are you insane say it's been a long six months and you were too afraid to tell her what you want want  pre  and that's how it works that's how you get the girl and then you say   i want you for worse or for better i would wait forever and ever broke your heart i'll put it back together i would wait forever and ever and that's how it works that's how you get the girl girl ohoh oh and that's how it works that's how you get the girl girl   remind her how it used to be be yeahyeah with pictures in frames of kisses on cheeks cheeks tell her how you must have lost your mind oohooh when you left her all alone and never told her why why  pre  and that's how it works that's how you lost the girl and now you say   i want you for worse or for better i would wait forever and ever ever and ever broke your heart i'll put it back together i would wait forever and ever and that's how it works that's how you get the girl girl ohoh ohoh and that's how it works that's how you get the girl girl yeah yeah   and you know oh oh oh oh oh oh oh oh oh oh that i don't want you to go oh oh  breakdown remind me how it used to be pictures in frames of kisses on cheeks and say you want me yeahyeah and then you say   'cause i want you for worse or for better worse or for better i would wait forever and ever ever and ever broke your heart i'll put it back together i would wait forever and ever i want you forever and ever and that's how it works that's how you get the girl girl this is how it works and that's how it works that's how you get the girl girl get the girl that's how it works and that's how it works that's how you get the girl girl oh oh oh oh oh oh oh oh oh oh and that's how it works that's how you get the girl girl oh oh oh oh oh oh oh oh oh oh   that's how it works that's how you got the girl
103,Taylor Swift,Holy Ground,Red (Deluxe Edition),2012,2012-10-22,i was reminiscing just the other day while having coffee all alone and lord it took me away back to a firstglance feeling on new york time back when you fit in my poems like a perfect rhyme took off faster than a green light go hey you skip the conversation when you already know i left a note on the door with a joke we'd made and that was the first day   and darling it was good never looking down and right there where we stood was holy ground   spinning like a girl in a brand new dress we had this big wide city all to ourselves we blocked the noise with the sound of i need you and for the first time i had something to lose and i guess we fell apart in the usual way and the story's got dust on every page but sometimes i wonder how you think about it now and i see your face in every crowd   'cause darling it was good never looking down and right there where we stood was holy ground   tonight i'm gonna dance for all that we've been through but i don't wanna dance if i'm not dancing with you tonight i'm gonna dance like you were in this room but i don't wanna dance if i'm not dancing with you   it was good never looking down and right there where we stood was holy ground   tonight i'm gonna dance for all that we've been through but i don't wanna dance if i'm not dancing with you tonight i'm gonna dance like you were in this room but i don't wanna dance if i'm not dancing with you
104,Taylor Swift,Mine,Speak Now,2010,2010-08-04,you were in college working parttime waiting tables left a small town and never looked back i was a flight risk with a fear of falling wondering why we bother with love if it never lasts  pre  i say can you believe it as we're lying on the couch the moment i could see it yes yes i can see it now   do you remember we were sitting there by the water you put your arm around me for the first time you made a rebel of a careless man's careful daughter you are the best thing that's ever been mine   flash forward and we're taking on the world together and there's a drawer of my things at your place you learn my secrets and figure out why i'm guarded you say we'll never make my parents' mistakes  pre  but we got bills to pay we got nothing figured out when it was hard to take yes yes this is what i thought about   do you remember we were sitting there by the water you put your arm around me for the first time you made a rebel of a careless man's careful daughter you are the best thing that's ever been mine  do you remember all the city lights on the water you saw me start to believe for the first time you made a rebel of a careless man's careful daughter you are the best thing that's ever been mine   and i remember that fight 0 am as everything was slipping right out of our hands i ran out crying and you followed me out into the street braced myself for the goodbye 'cause that's all i've ever known then you took me by surprise you said i'll never leave you alone    you said i remember how we felt sitting by the water and every time i look at you it's like the first time i fell in love with a careless man's careful daughter she is the best thing that's ever been mine hold on make it last hold on never turn back you made a rebel of a careless man's careful daughter you are the best thing that's ever been mine   yeah yeah do you believe it hold on we're gonna make it now hold on and i can see it yeah yeah i can see it now see it now
105,Taylor Swift,Treacherous,Red (Deluxe Edition),2012,2012-10-22,put your lips close to mine as long as they don't touch out of focus eye to eye 'til the gravity's too much and i'll do anything you say if you say it with your hands and i'd be smart to walk away but you're quicksand    this slope is treacherous this path is reckless this slope is treacherous and iii like it   i can't decide if it's a choice getting swept away i hear the sound of my own voice asking you to stay and all we are is skin and bone trained to get along forever going with the flow but you're friction    this slope is treacherous this path is reckless this slope is treacherous and i i i like it   two headlights shine through the sleepless night and i will get you get you alone your name has echoed through my mind and i just think you should think you should know that nothing safe is worth the drive and i will follow you follow you home follow you follow you home    this hope is treacherous this daydream is dangerous this hope is treacherous iii iii iii  breakdown two headlights shine through the sleepless night and i will get you get you alone your name has echoed through my mind and i just think you should think you should know that nothing safe is worth the drive and i will follow you follow you home follow you follow you home i'll follow you follow you home follow you follow you home   this slope is treacherous iii like it
106,Taylor Swift,Back to December,Speak Now,2010,2010-10-12,i'm so glad you made time to see me how's life tell me how's your family i haven't seen them in a while you've been good busier than ever we small talk work and the weather your guard is up and i know why  pre because the last time you saw me is still burned in the back of your mind you gave me roses and i left them there to die   so this is me swallowing my pride standing in front of you saying i'm sorry for that night and i'd go back to december all the time it turns out freedom ain't nothing but missing you wishing i'd realized what i had when you were mine  post i'd go back to december turn around and make it alright i go back to december all the time   these days i haven't been sleeping staying up playing back myself leaving when your birthday passed and i didn't call and i think about summer all the beautiful times i watched you laughing from the passenger side and realized i loved you in the fall  pre and then the cold came the dark days when fear crept into my mind you gave me all your love and all i gave you was goodbye   so this is me swallowing my pride standing in front of you saying i'm sorry for that night and i'd go back to december all the time it turns out freedom ain't nothing but missing you wishing i'd realized what i had when you were mine  post i'd go back to december turn around and change my own mind i go back to december all the time   i miss your tan skin your sweet smile so good to me so right and how you held me in your arms that september night the first time you ever saw me cry maybe this is wishful thinking probably mindless dreaming but if we loved again i swear i'd love you right i'd go back in time and change it but i can't so if the chain is on your door i understand   but this is me swallowing my pride standing in front of you saying i'm sorry for that night and i'd go back to december it turns out freedom ain't nothing but missing you wishing i'd realized what i had when you were mine  post i'd go back to december turn around and make it alright i'd go back to december turn around and change my own mind i go back to december all the time   all the time
107,Taylor Swift,Long Live,Speak Now,2010,2010-10-25,i said remember this moment in the back of my mind the time we stood with our shaking hands the crowds in stands went wild we were the kings and the queens and they read off our names the night you danced like you knew our lives would never be the same you held your head like a hero on a history book page it was the end of a decade but the start of an age   long live the walls we crashed through all the kingdom lights shined just for me and you i was screaming long live all the magic we made and bring on all the pretenders one day we will be remembered   i said remember this feeling i passed the pictures around of all the years that we stood there on the sidelines wishing for right now we are the kings and the queens you traded your baseball cap for a crown when they gave us our trophies and we held them up for our town and the cynics were outraged screaming this is absurd 'cause for a moment a band of thieves in ripped up jeans got to rule the world   long live the walls we crashed through all the kingdom lights shined just for me and you i was screaming long live all the magic we made and bring on all the pretenders i'm not afraid long live all the mountains we moved i had the time of my life fighting dragons with you i was screaming long live that look on your face and bring on all the pretenders one day we will be remembered   hold on to spinning around confetti falls to the ground may these memories break our fall  breakdown will you take a moment promise me this that you'll stand by me forever but if god forbid fate should step in and force us into a goodbye if you have children some day when they point to the pictures please tell them my name tell them how the crowds went wild tell them how i hope they shine long live the walls we crashed through i had the time of my life with you   long long live the walls we crashed through all the kingdom lights shined just for me and you i was screaming long live all the magic we made and bring on all the pretenders i'm not afraid singing long live all the mountains we moved i had the time of my life fighting dragons with you and long long live that look on your face and bring on all the pretenders one day we will be remembered
108,Taylor Swift,Beautiful Ghosts,Cats: Highlights From the Motion Picture Soundtrack,2019,2019-11-15,follow me home if you dare to i wouldn't know where to lead you should i take chances when no one took chances on me so i watch from the dark wait for my life to start with no beauty in my memory   all that i wanted was to be wanted too young to wander london streets alone and haunted born into nothing at least you have something something to cling to visions of dazzling rooms i'll never get let into and the memories were lost long ago but at least you have beautiful ghosts   perilous night their voices calling a flicker of light before the dawning out here the wild ones are taming the fear within me scared to call them my friends and be broken again is this hope just a mystical dream   all that i wanted was to be wanted too young to wander london streets alone and haunted born into nothing at least you have something something to cling to visions of dazzling rooms i'll never get let into and the memories were lost long ago but at least you have beautiful ghosts   and so maybe my home isn't what i had known what i thought it would be but i feel so alive with these phantoms of night and i know that this life isn't safe but it's wild and it's free   all that i wanted was to be wanted i'll never wander london streets alone and haunted born into nothing with them i have something something to cling to i never knew i'd love this world they've let me into and the memories were lost long ago so i'll dance with these beautiful ghosts and the memories were lost long ago so i'll dance with these beautiful ghosts
109,Taylor Swift,The Moment I Knew,Red (Deluxe Edition),2012,2012-10-22,you should've been there should've burst through the door with that baby i'm right here smile and it would've felt like a million little shining stars had just aligned and i would've been so happy   christmas lights glisten i've got my eye on the door just waiting for you to walk in but the time is ticking people ask me how i've been as i comb back through my memory how you said you'd be here you said you'd be here   and it was like slow motion standing there in my party dress in red lipstick with no one to impress and they're all laughing as i'm looking around the room but there was one thing missing and that was the moment i knew   and the hours pass by now i just wanna be alone but your close friends always seem to know when there's something really wrong so they follow me down the hall and there in the bathroom i try not to fall apart and the sinking feeling starts as i say hopelessly he said he'd be here   and it was like slow motion standing there in my party dress in red lipstick with no one to impress and they're all laughing and asking me about you but there was one thing missing missing and that was the moment i knew   what do you say when tears are streaming down your face in front of everyone you know and what do you do when the one who means the most to you is the one who didn't show  breakdown you should've been here and i would've been so happy   and it was like slow motion standing there in my party dress in red lipstick with no one to impress and they're all standing around me singing happy birthday to you but there was one thing missing and that was the moment i knew ohohohohohohoh i knew ohohohohohohoh   you called me later and said i'm sorry i didn't make it and i said i'm sorry too and that was the moment i knew
110,Taylor Swift,Mean,Speak Now,2011,2011-03-13,you with your words like knives and swords and weapons that you use against me you have knocked me off my feet again got me feeling like i'm nothing you with your voice like nails on a chalkboard calling me out when i'm wounded you picking on the weaker man  pre well you can take me down with just one single blow but you don't know what you don't know   someday i'll be living in a big old city and all you're ever gonna be is mean someday i'll be big enough so you can't hit me and all you're ever gonna be is mean why you gotta be so mean   you with your switching sides and your wildfire lies and your humiliation you have pointed out my flaws again as if i don't already see them i walk with my head down trying to block you out 'cause i'll never impress you i just wanna feel okay again  pre i bet you got pushed around somebody made you cold but the cycle ends right now 'cause you can't lead me down that road and you don't know what you don't know   someday i'll be living in a big old city and all you're ever gonna be is mean someday i'll be big enough so you can't hit me and all you're ever gonna be is mean why you gotta be so mean   and i can see you years from now in a bar talking over a football game with that same big loud opinion but nobody's listening washed up and ranting about the same old bitter things drunk and grumbling on about how i can't sing but all you are is mean all you are is mean and a liar and pathetic and alone in life and mean and mean and mean and mean  breakdown but someday i'll be living in a big old city and all you're ever gonna be is mean yeah   someday i'll be big enough so you can't hit me and all you're ever gonna be is mean why you gotta be so mean someday i'll be living in a big old city why you gotta be so mean and all you're ever gonna be is mean why you gotta be so mean someday i'll be big enough so you can't hit me why you gotta be so mean and all you're ever gonna be is mean why you gotta be so mean
111,Taylor Swift,Better Than Revenge,Speak Now,2010,2010-10-25,now go stand in the corner and think about what you did ha time for a little revenge   the story starts when it was hot and it was summer and i had it all i had him right there where i wanted him she came along got him alone and let's hear the applause she took him faster than you can say sabotage  pre  i never saw it coming wouldn't have suspected it i underestimated just who i was dealing with she had to know the pain was beating on me like a drum she underestimated just who she was stealing from   she's not a saint and she's not what you think she's an actress whoa she's better known for the things that she does on the mattress whoa soon she's gonna find stealing other people's toys on the playground won't make you many friends she should keep in mind she should keep in mind there is nothing i do better than revenge ha   she looks at life like it's a party and she's on the list she looks at me like i'm a trend and she's so over it i think her everpresent frown is a little troubling and she thinks i'm psycho 'cause i like to rhyme her name with things  pre  but sophistication isn't what you wear or who you know or pushing people down to get you where you wanna go oh they didn't teach you that in prep school so it's up to me but no amount of vintage dresses gives you dignity think about what you did   she's not a saint and she's not what you think she's an actress whoa she's better known for the things that she does on the mattress whoa soon she's gonna find stealing other people's toys on the playground won't make you many friends she should keep in mind she should keep in mind there is nothing i do better than revenge ha   i'm just another thing for you to roll your eyes at honey you might have him but haven't you heard i'm just another thing for you to roll your eyes at honey you might have him but i always get the last word whoa whoaahoh   she's not a saint and she's not what you think she's an actress whoa she deserved it she's better known for the things that she does on the mattress whoa soon she's gonna find stealing other people's toys on the playground won't make you many friends she should keep in mind she should keep in mind there is nothing i do better than revenge ha   do you still feel like you know what you're doing 'cause i don't think you do oh no no no no do you still feel like you know what you're doing no i don't think you do i don't think you do let's hear the applause come on come on come on show me how much better you are so much better yeah see you deserve some applause 'cause you're so much better she took him faster than you could say sabotage
112,Taylor Swift,The Last Time,Red (Deluxe Edition),2012,2012-10-22,gary lightbody find myself at your door just like all those times before im not sure how i got there all roads they lead me here i imagine you are home in your room all alone and you open your eyes into mine and everything feels better  pre taylor swift  gary lightbody and right before your eyes i'm breaking no past no reasons why just you and me   taylor swift  gary lightbody this is the last time i'm asking you this put my name at the top of your list this is the last time i'm asking you why you break my heart in the blink of an eye eye eye   taylor swift you find yourself at my door just like all those times before you wear your best apology but i was there to watch you leave and all the times i let you in just for you to go again disappear when you come back everything is better  pre taylor swift  gary lightbody and right before your eyes i'm aching run fast nowhere to hide just you and me   taylor swift  gary lightbody this is the last time i'm asking you this put my name at the top of your list this is the last time i'm asking you why you break my heart in the blink of an eye eye eye      taylor swift and gary lightbody this is the last time you tell me i've got it wrong this is the last time i say it's been you all along this is the last time i let you in my door this is the last time i won't hurt you anymore ohho ohho ohho ohho ohho ohho ohho ohho   taylor swift  gary lightbody this is the last time i'm asking you this put my name at the top of your list this is the last time i'm asking you why you break my heart in the blink of an eye   taylor swift gary lightbody both this is the last time i'm asking you this this is the last time i'm asking you this put my name at the top of your list put my name at the top of your list this is the last time i'm asking you why this is the last time i'm asking you why you break my heart in the blink of an eye you break my heart this is the last time i'm asking you last time i'm asking you last time i'm asking you this this is the last time i'm asking you last time i'm asking you last time i'm asking you this this is the last time i'm asking you last time i'm asking you last time i'm asking you this this is the last time i'm asking you last time i'm asking you last time i'm asking you this
113,Taylor Swift,Christmas Tree Farm,,2019,2019-12-06,my winter nights are taken up by static stress and holiday shopping traffic but i close my eyes and i'm somewhere else just like magic   in my heart is a christmas tree farm where the people would come to dance under sparkling lights bundled up in their mittens and coats and the cider would flow and i just wanna be there tonight  pre sweet dreams of holly and ribbon mistakes are forgiven and everythin' is icy and blue and you would be there too   under the mistletoe watchin' the fire glow and tellin' me i love you just bein' in your arms takes me back to that little farm where every wish comes true   in my heart is a christmas tree farm there's a light in the barn we run inside out from the cold in the town kids are dreamin' of sleighs and they're warm and they're safe they wake to see a blanket of snow  pre sweet dreams of holly and ribbon mistakes are forgiven and everythin' is icy and blue and you would be there too   under the mistletoe watchin' the fire glow and tellin' me i love you just bein' in your arms takes me back to that little farm where every wish comes true baby yeah   and when i'm feelin' alone you remind me of home oh baby baby merry christmas and when the world isn't fair i pretend that we're there baby baby merry christmas to you   under the mistletoe to you watching the fire glow and tellin' me i love you   oh baby baby merry christmas oh baby baby merry christmas darling oh baby baby merry christmas i love you oh baby baby merry christmas oh baby baby merry christmas i just want you to know oh baby baby merry christmas where every wish comes true i love you
114,Taylor Swift,Teardrops on My Guitar,Taylor Swift,2006,2006-10-24,drew looks at me i fake a smile so he won't see that i want and i'm needing everything that we should be  pre  i'll bet she's beautiful that girl he talks about and she's got everything that i have to live without   drew talks to me i laugh 'cause it's so damn funny that i can't even see anyone when he's with me  pre  he says he's so in love he's finally got it right i wonder if he knows he's all i think about at night   he's the reason for the teardrops on my  the only thing that keeps me wishing on a wishing star he's the song in the car i keep singing don't know why i do   drew walks by me can't he tell that i can't breathe and there he goes so perfectly the kind of flawless i wish i could be  pre  she'd better hold him tight give him all her love look in those beautiful eyes and know she's lucky 'cause   he's the reason for the teardrops on my  the only thing that keeps me wishing on a wishing star he's the song in the car i keep singing don't know why i do   so i drive home alone as i turn off the light i'll put his picture down and maybe get some sleep tonight   'cause he's the reason for the teardrops on my  the only one whos got enough of me to break my heart he's the song in the car i keep singing don't know why i do   he's the time taken up but there's never enough and he's all that i need to fall into drew looks at me i fake a smile so he won't see
